keyword,search_volume,kd,cpc,intent,cluster,discovery,n_variants,variants
free monochrome coloring pages printable,90,0,3.03,informational,Coloring — format (free/printable/pdf/online),dataforseo,1,free monochrome coloring pages printable
free printable bookmark coloring pages,90,0,,informational,Coloring — format (free/printable/pdf/online),dataforseo,1,free printable bookmark coloring pages
cute preppy coloring pages printable,90,0,,informational,Coloring — format (free/printable/pdf/online),dataforseo,1,cute preppy coloring pages printable
cute boba coloring pages printable,90,0,,informational,Coloring — format (free/printable/pdf/online),dataforseo,1,cute boba coloring pages printable
free printable lent coloring pages,90,0,,informational,Coloring — format (free/printable/pdf/online),dataforseo,1,free printable lent coloring pages
toothless coloring pages printable,90,0,,transactional,Coloring — format (free/printable/pdf/online),dataforseo,1,toothless coloring pages printable
octonauts printable coloring pages,90,0,,informational,Coloring — format (free/printable/pdf/online),dataforseo,1,octonauts printable coloring pages
printable full page coloring pages for adults,90,11,0.05,informational,Coloring — audience (kids/adults/toddler),dataforseo,1,printable full page coloring pages for adults
coloring book quotes,90,,0.18,,Coloring — format (free/printable/pdf/online),apify_autocomplete,1,coloring book quotes
coloring book templates free,90,,2.48,,Coloring — format (free/printable/pdf/online),apify_autocomplete,1,coloring book templates free
coloring book tiktok,90,,0.19,,Coloring — format (free/printable/pdf/online),apify_autocomplete,1,coloring book tiktok
coloring book trophy guide,90,,,,Coloring — format (free/printable/pdf/online),apify_autocomplete,1,coloring book trophy guide
coloring pages jellycat,90,,,,Coloring — animals,apify_autocomplete,1,coloring pages jellycat
cute drawing human,90,,,,Drawing ideas — by style/theme,apify_autocomplete,1,cute drawing human
cute drawing things,90,,0.04,,Drawing ideas — by style/theme,apify_autocomplete,1,cute drawing things
cute quokka drawing,90,,,,Drawing/sketch — other,apify_autocomplete,1,cute quokka drawing
drawing ideas app,90,,7.31,,Drawing ideas — by style/theme,apify_autocomplete,1,drawing ideas app
drawing ideas new,90,,0.02,,Drawing ideas — by style/theme,apify_autocomplete,1,drawing ideas new
drawing ideas to draw on your hand,90,,,,Drawing ideas — by style/theme,apify_autocomplete,1,drawing ideas to draw on your hand
drawing ideas to trace,90,,,,Drawing ideas — by style/theme,apify_autocomplete,1,drawing ideas to trace
easy drawing hummingbird,90,,0.02,,Coloring — animals,apify_autocomplete,1,easy drawing hummingbird
free printable adult coloring pages quotes,90,,1.36,,Coloring — format (free/printable/pdf/online),apify_autocomplete,1,free printable adult coloring pages quotes
free printable coloring pages dinosaur,90,,,,Coloring — animals,apify_autocomplete,1,free printable coloring pages dinosaur
free printable coloring pages ninjago,90,,,,Coloring — licensed/characters,apify_autocomplete,1,free printable coloring pages ninjago
how to draw quickly,90,,,,How to draw / tutorials,apify_autocomplete,1,how to draw quickly
how to draw xxtenations full body,90,,,,How to draw / tutorials,apify_autocomplete,1,how to draw xxtenations full body
how to get drawing ideas,90,,4.02,,Drawing ideas — by style/theme,apify_autocomplete,1,how to get drawing ideas
things to draw advanced,90,,,,Drawing ideas — by style/theme,apify_autocomplete,1,things to draw advanced
things to draw humans,90,,,,Drawing ideas — by style/theme,apify_autocomplete,1,things to draw humans
things to draw that start with a,90,,,,Drawing ideas — by style/theme,apify_autocomplete,1,things to draw that start with a
unicorn academy coloring pages printable,90,,,,Coloring — unicorn/fairy/fantasy/princess,apify_autocomplete,1,unicorn academy coloring pages printable
unicorn coloring pages pdf,90,,,,Coloring — unicorn/fairy/fantasy/princess,apify_autocomplete,1,unicorn coloring pages pdf
best free printable coloring pages for adults advanced,70,2,2.46,commercial,Coloring — audience (kids/adults/toddler),dataforseo,1,best free printable coloring pages for adults advanced
stress relief coloring pages for adults pdf,70,9,5.13,informational,Coloring — audience (kids/adults/toddler),dataforseo,1,stress relief coloring pages for adults pdf
free calming coloring pages for students,70,0,14.26,informational,Coloring — format (free/printable/pdf/online),dataforseo,1,free calming coloring pages for students
fantasy coloring pages printable,70,2,0.47,informational,Coloring — unicorn/fairy/fantasy/princess,dataforseo,1,fantasy coloring pages printable
sketchbook drawing ideas easy,70,0,,informational,Coloring — format (free/printable/pdf/online),dataforseo,1,sketchbook drawing ideas easy
pinterest drawing ideas colourful,70,0,,informational,Drawing ideas — by style/theme,dataforseo,1,pinterest drawing ideas colourful
pencil drawing ideas images,70,0,16.79,informational,Drawing ideas — by style/theme,dataforseo,1,pencil drawing ideas images
40 easy drawing ideas for beginners with pencil,70,0,1.52,informational,Drawing ideas — by style/theme,dataforseo,1,40 easy drawing ideas for beginners with pencil
how to draw anime luffy,70,0,,informational,How to draw / tutorials,dataforseo,1,how to draw anime luffy
how to draw pdf book,70,0,,informational,Coloring — format (free/printable/pdf/online),dataforseo,1,how to draw pdf book
hard things to draw for beginners,70,0,,informational,Drawing ideas — by style/theme,dataforseo,1,hard things to draw for beginners
top 10 hardest things to draw,70,0,,informational,Drawing ideas — by style/theme,dataforseo,1,top 10 hardest things to draw
beautiful sketch drawing ideas,70,0,,informational,Drawing ideas — by style/theme,dataforseo,1,beautiful sketch drawing ideas
free sketch ideas,70,13,,informational,Coloring — format (free/printable/pdf/online),dataforseo,1,free sketch ideas
sketch ideas eyes,70,0,,informational,Drawing ideas — by style/theme,dataforseo,2,sketch ideas eyes ; eye sketch ideas
drawing ideas sketch for beginners,70,7,0.01,informational,Drawing ideas — by style/theme,dataforseo,4,drawing ideas sketch for beginners ; drawing sketch ideas for beginners ; sketch drawing ideas for beginners ; beginners sketch drawing ideas
horror sketch ideas,70,0,,informational,Drawing ideas — by style/theme,dataforseo,1,horror sketch ideas
sketch drawing ideas flowers,70,0,0.02,informational,Coloring — flowers/nature/food/vehicles,dataforseo,1,sketch drawing ideas flowers
sketch ideas body,70,2,,informational,Drawing ideas — by style/theme,dataforseo,2,sketch ideas body ; body sketch ideas
sketch reference ideas,70,1,,informational,Drawing/sketch — other,dataforseo,1,sketch reference ideas
sketch ideas for canvas,70,0,0.26,informational,Drawing ideas — by style/theme,dataforseo,2,sketch ideas for canvas ; canvas sketch ideas
creepy sketch ideas,70,0,,informational,Drawing ideas — by style/theme,dataforseo,1,creepy sketch ideas
background sketch ideas,70,0,,informational,Drawing ideas — by style/theme,dataforseo,2,background sketch ideas ; sketch background ideas
abstract sketch ideas,70,0,,informational,Drawing ideas — by style/theme,dataforseo,1,abstract sketch ideas
pose sketch ideas,70,0,,informational,Drawing ideas — by style/theme,dataforseo,2,pose sketch ideas ; sketch pose ideas
funny sketch ideas,70,0,,informational,Drawing ideas — by style/theme,dataforseo,1,funny sketch ideas
sketch ideas pinterest aesthetic,70,0,,navigational,Drawing ideas — by style/theme,dataforseo,4,sketch ideas pinterest aesthetic ; aesthetic sketch ideas pinterest ; pinterest sketch ideas aesthetic ; pinterest aesthetic sketch ideas
practice sketch ideas,70,0,,informational,Drawing ideas — by style/theme,dataforseo,2,practice sketch ideas ; sketch practice ideas
easy etch a sketch ideas,70,0,,informational,Drawing ideas — by style/theme,dataforseo,2,etch a sketch ideas easy ; easy etch a sketch ideas
sketch ideas for adults,70,0,0.04,informational,Coloring — audience (kids/adults/toddler),dataforseo,1,sketch ideas for adults
dragon sketch ideas,70,0,0.15,informational,Coloring — unicorn/fairy/fantasy/princess,dataforseo,1,dragon sketch ideas
valentine day sketch ideas,70,0,,informational,Coloring — seasonal/holiday,dataforseo,2,valentine day sketch ideas ; valentine's day sketch ideas
fashion sketch ideas,70,12,0.74,informational,Drawing ideas — by style/theme,dataforseo,1,fashion sketch ideas
sketch ideas pinterest easy,70,1,,informational,Drawing ideas — by style/theme,dataforseo,4,sketch ideas pinterest easy ; easy sketch ideas pinterest ; pinterest easy sketch ideas ; pinterest sketch ideas easy
sketch drawing ideas easy for beginners,70,9,,informational,Drawing ideas — by style/theme,dataforseo,3,easy sketch drawing ideas for beginners ; sketch drawing ideas easy for beginners ; sketch easy drawing ideas for beginners
etch a sketch ideas,70,0,,informational,Drawing ideas — by style/theme,dataforseo,1,etch a sketch ideas
chalkboard doodle ideas,70,0,0.01,informational,Drawing ideas — by style/theme,dataforseo,1,chalkboard doodle ideas
calendar doodle ideas,70,0,0.01,informational,Drawing ideas — by style/theme,dataforseo,1,calendar doodle ideas
doodle ideas for adults,70,0,0.05,informational,Coloring — audience (kids/adults/toddler),dataforseo,1,doodle ideas for adults
doodle ideas lines,70,0,0.01,informational,Drawing ideas — by style/theme,dataforseo,3,doodle ideas lines ; line doodle ideas ; doodle lines ideas
pinterest doodle drawing ideas,70,1,,navigational,Drawing ideas — by style/theme,dataforseo,2,doodle drawing ideas pinterest ; pinterest doodle drawing ideas
doodle ideas things to draw when bored easy,70,0,,informational,Drawing ideas — by style/theme,dataforseo,1,doodle ideas things to draw when bored easy
chalk doodle ideas,70,0,0.01,informational,Drawing ideas — by style/theme,dataforseo,1,chalk doodle ideas
doodle ideas for sketchbook,70,0,,informational,Coloring — format (free/printable/pdf/online),dataforseo,3,doodle ideas for sketchbook ; sketchbook doodle ideas ; doodle sketchbook ideas
gun coloring pages printable,70,0,,informational,Coloring — format (free/printable/pdf/online),dataforseo,1,gun coloring pages printable
bts coloring pages printable,70,0,,transactional,Coloring — format (free/printable/pdf/online),dataforseo,1,bts coloring pages printable
coloring cute animals,70,0,0.04,informational,Coloring — animals,dataforseo,1,coloring cute animals
nike coloring pages printable,70,0,,informational,Coloring — format (free/printable/pdf/online),dataforseo,1,nike coloring pages printable
basketball coloring pages free printable,70,0,,informational,Coloring — format (free/printable/pdf/online),dataforseo,1,basketball coloring pages free printable
bus printable coloring pages,70,0,,informational,Coloring — format (free/printable/pdf/online),dataforseo,1,bus printable coloring pages
cute coloring pages for teens printable,70,10,,informational,Coloring — audience (kids/adults/toddler),dataforseo,1,cute coloring pages for teens printable
cute cow coloring pages printable,70,0,0.01,informational,Coloring — format (free/printable/pdf/online),dataforseo,1,cute cow coloring pages printable
easy mandala coloring pages for adults,70,9,,informational,Coloring — audience (kids/adults/toddler),dataforseo,1,easy mandala coloring pages for adults
raccoon coloring pages printable,70,0,,informational,Coloring — format (free/printable/pdf/online),dataforseo,1,raccoon coloring pages printable
easy cute printable coloring pages,70,16,0.01,informational,Coloring — format (free/printable/pdf/online),dataforseo,2,easy cute printable coloring pages ; cute coloring pages easy printable
happy easter coloring pages printable,70,0,0.22,informational,Coloring — seasonal/holiday,dataforseo,1,happy easter coloring pages printable
monday mandala coloring pages printable,70,16,,navigational,Coloring — format (free/printable/pdf/online),dataforseo,1,monday mandala coloring pages printable
free printable kuromi coloring pages,70,0,,informational,Coloring — licensed/characters,dataforseo,1,free printable kuromi coloring pages
messi printable coloring pages,70,0,,informational,Coloring — format (free/printable/pdf/online),dataforseo,1,messi printable coloring pages
printable design coloring pages,70,45,,informational,Coloring — format (free/printable/pdf/online),dataforseo,1,printable design coloring pages
art coloring pages free,70,27,0.61,informational,Coloring — format (free/printable/pdf/online),dataforseo,2,art coloring pages free ; free coloring art pages
printable seahawks coloring pages,70,0,,informational,Coloring — format (free/printable/pdf/online),dataforseo,1,printable seahawks coloring pages
free printable wicked coloring pages,70,0,,transactional,Coloring — format (free/printable/pdf/online),dataforseo,1,free printable wicked coloring pages
printable pattern coloring pages for adults,70,4,1.55,informational,Coloring — audience (kids/adults/toddler),dataforseo,1,printable pattern coloring pages for adults
nurse coloring book,70,0,0.32,informational,Coloring — format (free/printable/pdf/online),dataforseo,1,nurse coloring book
free printable peterbilt coloring pages,70,0,,informational,Coloring — format (free/printable/pdf/online),dataforseo,1,free printable peterbilt coloring pages
mardi gras coloring pages printable,70,0,,informational,Coloring — format (free/printable/pdf/online),dataforseo,1,mardi gras coloring pages printable
free bow coloring pages,70,0,,informational,Coloring — format (free/printable/pdf/online),dataforseo,1,free bow coloring pages
st patrick coloring pages printable,70,0,,informational,Coloring — format (free/printable/pdf/online),dataforseo,1,st patrick coloring pages printable
giraffe coloring pages for adults,70,0,2.95,informational,Coloring — audience (kids/adults/toddler),dataforseo,1,giraffe coloring pages for adults
bee coloring book,70,0,0.04,informational,Coloring — format (free/printable/pdf/online),dataforseo,1,bee coloring book
coloring book heart,70,,0.31,,Coloring — format (free/printable/pdf/online),apify_autocomplete,1,coloring book heart
coloring book journal,70,,0.33,,Coloring — format (free/printable/pdf/online),apify_autocomplete,1,coloring book journal
coloring book zine,70,,0.25,,Coloring — format (free/printable/pdf/online),apify_autocomplete,1,coloring book zine
coloring pages abc mouse,70,,,,Coloring — general/other,apify_autocomplete,1,coloring pages abc mouse
coloring pages jjk,70,,,,Coloring — general/other,apify_autocomplete,1,coloring pages jjk
coloring pages number blocks,70,,,,Coloring — general/other,apify_autocomplete,1,coloring pages number blocks
coloring pages quilt blocks,70,,0.03,,Coloring — general/other,apify_autocomplete,1,coloring pages quilt blocks
coloring pages zootopia 2,70,,,,Coloring — licensed/characters,apify_autocomplete,1,coloring pages zootopia 2
drawing ideas advanced,70,,,,Drawing ideas — by style/theme,apify_autocomplete,1,drawing ideas advanced
drawing ideas jellyfish,70,,,,Drawing ideas — by style/theme,apify_autocomplete,1,drawing ideas jellyfish
drawing ideas jesus,70,,,,Drawing ideas — by style/theme,apify_autocomplete,1,drawing ideas jesus
drawing ideas video,70,,,,Drawing ideas — by style/theme,apify_autocomplete,1,drawing ideas video
free printable coloring pages noah's ark,70,,,,Coloring — format (free/printable/pdf/online),apify_autocomplete,1,free printable coloring pages noah's ark
free printable coloring pages quotes,70,,17.43,,Coloring — format (free/printable/pdf/online),apify_autocomplete,1,free printable coloring pages quotes
free printable quilt coloring pages,70,,,,Coloring — format (free/printable/pdf/online),apify_autocomplete,1,free printable quilt coloring pages
free printable zombie coloring pages,70,,,,Coloring — format (free/printable/pdf/online),apify_autocomplete,1,free printable zombie coloring pages
how to draw 5 nights at freddy's,70,,,,How to draw / tutorials,apify_autocomplete,1,how to draw 5 nights at freddy's
how to draw 5 point perspective,70,,,,How to draw / tutorials,apify_autocomplete,1,how to draw 5 point perspective
how to draw 8,70,,,,How to draw / tutorials,apify_autocomplete,1,how to draw 8
how to draw 8 bit,70,,,,How to draw / tutorials,apify_autocomplete,1,how to draw 8 bit
how to draw 8 bit mario,70,,,,Coloring — licensed/characters,apify_autocomplete,1,how to draw 8 bit mario
how to draw quagmire,70,,,,How to draw / tutorials,apify_autocomplete,1,how to draw quagmire
magical unicorn coloring pages,70,,0.02,,Coloring — unicorn/fairy/fantasy/princess,apify_autocomplete,1,magical unicorn coloring pages
things to draw that start with e,70,,,,Drawing ideas — by style/theme,apify_autocomplete,1,things to draw that start with e
things to draw that start with n,70,,,,Drawing ideas — by style/theme,apify_autocomplete,1,things to draw that start with n
unicorn coloring pages for preschoolers,70,,0.02,,Coloring — unicorn/fairy/fantasy/princess,apify_autocomplete,1,unicorn coloring pages for preschoolers
unicorn horse coloring pages,70,,0.08,,Coloring — animals,apify_autocomplete,1,unicorn horse coloring pages
coloring pages for teens online,50,84,0.24,commercial,Coloring — audience (kids/adults/toddler),dataforseo,1,coloring pages for teens online
preschool coloring pages pdf printable,50,14,0.88,navigational,Coloring — audience (kids/adults/toddler),dataforseo,1,preschool coloring pages pdf printable
free printable preschool coloring pages pdf,50,15,,navigational,Coloring — audience (kids/adults/toddler),dataforseo,1,free printable preschool coloring pages pdf
drawing ideas easy cute for beginners,50,6,0.02,informational,Drawing ideas — by style/theme,dataforseo,2,drawing ideas easy cute for beginners ; cute drawing ideas easy for beginners
cute drawing ideas easy and beautiful,50,0,0.03,informational,Drawing ideas — by style/theme,dataforseo,1,cute drawing ideas easy and beautiful
pinterest drawing ideas aesthetic easy,50,0,,informational,Drawing ideas — by style/theme,dataforseo,1,pinterest drawing ideas aesthetic easy
beautiful drawing with colour,50,0,,informational,Coloring — general/other,dataforseo,1,beautiful drawing with colour
cute aesthetic drawings easy with pencil,50,0,,informational,Drawing ideas — by style/theme,dataforseo,1,cute aesthetic drawings easy with pencil
labubu drawing video,50,0,,navigational,Drawing/sketch — other,dataforseo,1,labubu drawing video
pencil drawing book pdf free download,50,0,5.42,transactional,Coloring — format (free/printable/pdf/online),dataforseo,1,pencil drawing book pdf free download
how to draw stuff on youtube,50,22,,informational,How to draw / tutorials,dataforseo,1,how to draw stuff on youtube
art hub how to draw youtube,50,31,,informational,How to draw / tutorials,dataforseo,1,art hub how to draw youtube
cute drawing ideas for beginners,50,0,0.01,informational,Drawing ideas — by style/theme,dataforseo,1,cute drawing ideas for beginners
drawing for adults easy,50,26,1.75,informational,Coloring — audience (kids/adults/toddler),dataforseo,1,drawing for adults easy
photo to coloring page ai,50,31,1.66,informational,"Tool/feature (photo→coloring, generator, AI)",dataforseo,1,photo to coloring page ai
turn pictures into coloring pages for free online,50,11,1.3,informational,Coloring — format (free/printable/pdf/online),dataforseo,1,turn pictures into coloring pages for free online
free app to turn photo into coloring page,50,19,1.46,transactional,"Tool/feature (photo→coloring, generator, AI)",dataforseo,1,free app to turn photo into coloring page
urban sketch ideas,50,0,0.11,informational,Drawing ideas — by style/theme,dataforseo,1,urban sketch ideas
simple pencil sketch ideas,50,1,,informational,Drawing ideas — by style/theme,dataforseo,2,simple pencil sketch ideas ; simple sketch ideas with pencil
sketch ideas for beginners with pencil,50,0,,informational,Drawing ideas — by style/theme,dataforseo,2,sketch ideas for beginners with pencil ; pencil sketch ideas for beginners
pretty sketch ideas,50,0,,informational,Drawing ideas — by style/theme,dataforseo,1,pretty sketch ideas
cute sketch ideas easy,50,0,,informational,Drawing ideas — by style/theme,dataforseo,3,cute sketch ideas easy ; easy cute sketch ideas ; easy sketch ideas cute
cool sketch ideas easy,50,7,,informational,Drawing ideas — by style/theme,dataforseo,2,cool sketch ideas easy ; cool easy sketch ideas
sketch harry potter drawing ideas,50,0,,informational,Drawing ideas — by style/theme,dataforseo,1,sketch harry potter drawing ideas
easy sketch christmas drawing ideas,50,0,,informational,Coloring — seasonal/holiday,dataforseo,2,sketch christmas drawing ideas easy ; easy sketch christmas drawing ideas
pumpkin sketch ideas,50,16,,informational,Coloring — seasonal/holiday,dataforseo,1,pumpkin sketch ideas
dragon puppet sketch ideas,50,0,,informational,Coloring — unicorn/fairy/fantasy/princess,dataforseo,2,dragon puppet sketch ideas ; dragon puppet ideas sketch
mini sketch ideas,50,0,,informational,Drawing ideas — by style/theme,dataforseo,1,mini sketch ideas
sketch ideas creative,50,0,,informational,Drawing ideas — by style/theme,dataforseo,2,sketch ideas creative ; creative sketch ideas
simple sketch ideas for beginners,50,0,,informational,Drawing ideas — by style/theme,dataforseo,1,simple sketch ideas for beginners
notebook sketch ideas,50,0,,informational,Coloring — format (free/printable/pdf/online),dataforseo,2,notebook sketch ideas ; sketch notebook ideas
spring sketch ideas,50,0,0.04,informational,Coloring — seasonal/holiday,dataforseo,1,spring sketch ideas
paint sketch ideas,50,2,0.02,informational,Drawing ideas — by style/theme,dataforseo,2,paint sketch ideas ; sketch and paint ideas
painting sketch ideas,50,5,0.44,informational,Drawing ideas — by style/theme,dataforseo,3,painting sketch ideas ; painting ideas sketch ; sketch painting ideas
y2k sketch ideas,50,0,,informational,Drawing ideas — by style/theme,dataforseo,1,y2k sketch ideas
sketch ideas for beginners step by step,50,21,,informational,Drawing ideas — by style/theme,dataforseo,2,step by step sketch ideas for beginners ; sketch ideas for beginners step by step
drawing ideas sketch anime,50,0,,informational,Drawing ideas — by style/theme,dataforseo,4,drawing ideas sketch anime ; sketch drawing ideas anime ; anime sketch drawing ideas ; anime drawing ideas sketch
sketch ideas face,50,0,,informational,Drawing ideas — by style/theme,dataforseo,2,sketch ideas face ; face sketch ideas
cool sketch drawing ideas,50,6,,informational,Drawing ideas — by style/theme,dataforseo,3,cool sketch drawing ideas ; cool drawing ideas sketch ; sketch drawing ideas cool
sketch ideas skull,50,0,,informational,Drawing ideas — by style/theme,dataforseo,2,sketch ideas skull ; skull sketch ideas
character sketch ideas,50,3,,informational,Drawing ideas — by style/theme,dataforseo,1,character sketch ideas
cat sketch ideas,50,0,0.02,informational,Coloring — animals,dataforseo,1,cat sketch ideas
trippy sketch ideas,50,0,,informational,Drawing ideas — by style/theme,dataforseo,1,trippy sketch ideas
harry potter sketch ideas,50,0,,informational,Drawing ideas — by style/theme,dataforseo,1,harry potter sketch ideas
grunge sketch ideas,50,0,,informational,Drawing ideas — by style/theme,dataforseo,1,grunge sketch ideas
dress design sketch ideas,50,3,0.02,informational,Drawing ideas — by style/theme,dataforseo,2,dress design sketch ideas ; dress design ideas sketch
little sketch ideas,50,0,0.05,informational,Drawing ideas — by style/theme,dataforseo,1,little sketch ideas
scary sketch ideas,50,0,,informational,Drawing ideas — by style/theme,dataforseo,1,scary sketch ideas
dark sketch ideas,50,0,,informational,Drawing ideas — by style/theme,dataforseo,1,dark sketch ideas
person sketch ideas,50,0,,informational,Drawing ideas — by style/theme,dataforseo,1,person sketch ideas
daily doodle ideas,50,0,0.08,informational,Drawing ideas — by style/theme,dataforseo,1,daily doodle ideas
doodle ideas cat,50,0,0.01,informational,Coloring — animals,dataforseo,2,doodle ideas cat ; cat doodle ideas
abstract doodle ideas,50,0,,informational,Drawing ideas — by style/theme,dataforseo,1,abstract doodle ideas
doodle ideas easy for beginners,50,0,0.05,informational,Drawing ideas — by style/theme,dataforseo,2,doodle ideas easy for beginners ; easy doodle ideas for beginners
graffiti doodle ideas,50,0,,informational,Drawing ideas — by style/theme,dataforseo,1,graffiti doodle ideas
doodle ideas spring,50,0,0.03,informational,Coloring — seasonal/holiday,dataforseo,2,doodle ideas spring ; spring doodle ideas
september doodle ideas,50,0,,informational,Drawing ideas — by style/theme,dataforseo,1,september doodle ideas
easy art doodle ideas,50,0,0.07,informational,Drawing ideas — by style/theme,dataforseo,3,easy art doodle ideas ; easy doodle art ideas ; doodle art ideas easy
cute journal doodle ideas,50,0,0.01,informational,Drawing ideas — by style/theme,dataforseo,1,cute journal doodle ideas
trippy doodle ideas,50,0,,informational,Drawing ideas — by style/theme,dataforseo,1,trippy doodle ideas
birthday card doodle ideas,50,0,0.09,informational,Drawing ideas — by style/theme,dataforseo,2,birthday card doodle ideas ; doodle birthday card ideas
