keyword,search_volume,kd,cpc,intent,cluster,discovery,n_variants,variants
coloring pages,673000,28,1.25,informational,Coloring — general/other,dataforseo,4,coloring pages ; coloring in pages ; pages for coloring ; coloring and pages
coloring book pages to color,673000,50,1.25,informational,Coloring — format (free/printable/pdf/online),dataforseo,1,coloring book pages to color
coloring pages book,673000,4,0.53,informational,Coloring — format (free/printable/pdf/online),dataforseo,12,coloring pages book ; coloring pages of book ; coloring page book ; coloring book page ; coloring book pages ; coloring books pages
coloring pages pages,673000,28,1.25,informational,Coloring — general/other,dataforseo,1,coloring pages pages
coloring book pictures to color,673000,28,1.25,informational,Coloring — format (free/printable/pdf/online),dataforseo,1,coloring book pictures to color
how to drawing ideas,450000,5,0.98,informational,Drawing ideas — by style/theme,dataforseo,10,how to drawing ideas ; drawing ideas ; ideas drawing ; ideas of drawing ; drawing on ideas ; ideas to drawing
draw drawing ideas,450000,7,1.06,informational,Drawing ideas — by style/theme,dataforseo,1,draw drawing ideas
drawing drawing ideas,450000,5,1.06,informational,Drawing ideas — by style/theme,dataforseo,1,drawing drawing ideas
things to draw,368000,0,1.75,informational,Drawing ideas — by style/theme,dataforseo,6,things to draw ; things to draw on ; how to draw things ; things to draw with ; how to draw a things ; how to draw the things
how to draw,301000,28,4.32,informational,How to draw / tutorials,dataforseo,9,how to draw ; how to draw a ; how to draw how ; how to a draw ; how how to draw ; draw how to
cute drawings,301000,1,0.02,informational,Drawing ideas — by style/theme,dataforseo,1,cute drawings
easy to draw drawing,301000,10,0.13,informational,Drawing/sketch — other,dataforseo,7,easy to draw drawing ; how to draw a easy drawing ; drawing easy to draw ; drawing that are easy to draw ; easy draw drawing ; drawing to draw easy
easy to drawing,301000,9,0.2,informational,Drawing/sketch — other,dataforseo,10,easy to drawing ; how to drawing easy ; easy drawing ; drawing easy ; drawing a easy ; how drawing easy
how to draw drawing,301000,34,4.32,informational,How to draw / tutorials,dataforseo,6,how to draw drawing ; how to draw drawings ; how to draw a drawing ; how to draw the drawing ; drawing how to draw ; drawings how to draw
how to draw draw,301000,7,4.32,informational,How to draw / tutorials,dataforseo,6,how to draw draw ; how to draw a how to draw ; how to draw how to draw a ; how to draw a how to draw a ; draw how to draw ; to draw how to draw
how to draw how to draw how to draw,301000,43,4.32,informational,How to draw / tutorials,dataforseo,1,how to draw how to draw how to draw
coloring pages from crayola,165000,32,0.03,transactional,Coloring — general/other,dataforseo,1,coloring pages from crayola
coloring pages crayola,165000,23,0.03,informational,Coloring — general/other,dataforseo,3,coloring pages crayola ; coloring pages by crayola ; crayola coloring pages
crayola coloring book pages,165000,7,0.03,informational,Coloring — format (free/printable/pdf/online),dataforseo,1,crayola coloring book pages
how to draw rose,165000,0,0.1,informational,Coloring — flowers/nature/food/vehicles,dataforseo,8,how to draw rose ; how to draw roses ; how to draw a rose ; how to draw the rose ; rose how to draw ; roses how to draw
coloring pages of christmas,135000,23,0.1,informational,Coloring — seasonal/holiday,dataforseo,10,coloring pages on christmas ; coloring pages of christmas ; coloring pages for christmas ; coloring pages with christmas ; christmas coloring pages ; christmas pages coloring
ch coloring pages,135000,0,0.1,informational,Coloring — general/other,dataforseo,1,ch coloring pages
holiday coloring pages christmas,135000,4,0.1,informational,Coloring — seasonal/holiday,dataforseo,3,holiday coloring pages christmas ; christmas holiday coloring pages ; holiday christmas coloring pages
christmas day coloring pages,135000,29,0.1,informational,Coloring — seasonal/holiday,dataforseo,1,christmas day coloring pages
coloring book christmas pages,135000,2,0.1,informational,Coloring — seasonal/holiday,dataforseo,5,coloring book pages christmas ; coloring book christmas pages ; coloring book pages for christmas ; christmas coloring book page ; christmas coloring book pages
christmas coloring pages christmas,135000,23,0.1,informational,Coloring — seasonal/holiday,dataforseo,2,christmas christmas coloring pages ; christmas coloring pages christmas
coloring pages xmas,135000,16,0.1,informational,Coloring — general/other,dataforseo,4,coloring pages xmas ; coloring pages for xmas ; xmas coloring pages ; coloring xmas pages
coloring pages about christmas,135000,23,0.1,informational,Coloring — seasonal/holiday,dataforseo,1,coloring pages about christmas
coloring pages christmas pages,135000,23,0.1,informational,Coloring — seasonal/holiday,dataforseo,1,coloring pages christmas pages
coloring pages sheets,135000,13,0.93,informational,Coloring — format (free/printable/pdf/online),dataforseo,1,coloring pages sheets
butterflies how to draw,135000,0,0.05,informational,How to draw / tutorials,dataforseo,1,butterflies how to draw
how to draw dog,135000,0,0.2,informational,Coloring — animals,dataforseo,10,how to draw dog ; how to draw dogs ; how to draw a dog ; how to draw a dogs ; dog how to draw ; dogs how to draw
how to draw a butterfly,135000,5,0.06,informational,Coloring — animals,dataforseo,5,how to draw a butterfly ; how to draw the butterfly ; butterfly how to draw ; how to how to draw a butterfly ; how to to draw a butterfly
coloring book sheet,135000,24,0.93,transactional,Coloring — format (free/printable/pdf/online),dataforseo,2,coloring book sheet ; coloring book sheets
coloring sheets,135000,24,0.93,informational,Coloring — format (free/printable/pdf/online),dataforseo,1,coloring sheets
kpop demon hunter coloring pages,110000,0,0.16,navigational,Coloring — licensed/characters,dataforseo,2,kpop demon hunter coloring pages ; kpop demon hunters coloring pages
k-pop demon hunters coloring pages,110000,0,0.16,navigational,Coloring — licensed/characters,dataforseo,2,k-pop demon hunters coloring pages ; k pop demon hunters coloring pages
how to draw tree,110000,1,0.16,informational,Coloring — flowers/nature/food/vehicles,dataforseo,9,how to draw tree ; how to draw trees ; how to draw a tree ; how to draw an tree ; how to draw a trees ; how to draw the tree
how to draw spider-man,110000,0,0.2,informational,Coloring — licensed/characters,dataforseo,7,how to draw spider-man ; how to draw spider man ; how to draw a spider-man ; how to draw a spider man ; how to draw the spider man ; spider-man how to draw
printable coloring pages,90500,6,1.13,informational,Coloring — format (free/printable/pdf/online),dataforseo,11,printable coloring pages ; coloring pages printable ; coloring pages printables ; coloring pages and printables ; coloring pages that are printable ; printables coloring pages
coloring pages for adults,90500,4,1.45,informational,Coloring — audience (kids/adults/toddler),dataforseo,10,coloring pages for adults ; coloring pages adult ; coloring pages adults ; coloring pages of adults ; coloring pages for adult ; adult coloring pages
coloring pages free,90500,14,0.98,informational,Coloring — format (free/printable/pdf/online),dataforseo,9,coloring pages free ; coloring pages for free ; coloring pages that are free ; free coloring pages ; free pages coloring ; coloring free pages
free printable coloring pages,90500,9,1.16,informational,Coloring — format (free/printable/pdf/online),dataforseo,21,free printable coloring pages ; coloring pages free printable ; free printables coloring pages ; printable coloring pages for free ; coloring pages for free printable ; coloring pages printable free
coloring book page for adults,90500,1,1.45,informational,Coloring — audience (kids/adults/toddler),dataforseo,10,coloring book page for adults ; coloring book for adults pages ; coloring book pages for adults ; coloring books pages for adults ; coloring book pages adult ; coloring book pages adults
coloring pages free print,90500,8,1.18,informational,Coloring — format (free/printable/pdf/online),dataforseo,9,coloring pages print free ; coloring pages free print ; coloring pages for free print ; free coloring pages print ; print coloring pages free ; free to print coloring pages
coloring book pages free,90500,14,0.98,informational,Coloring — format (free/printable/pdf/online),dataforseo,5,coloring book pages free ; coloring book pages for free ; free coloring book page ; free coloring book pages ; free coloring books pages
printed coloring pages,90500,60,1.1,transactional,Coloring — format (free/printable/pdf/online),dataforseo,1,printed coloring pages
coloring pages to print out for free,90500,24,1.13,informational,Coloring — format (free/printable/pdf/online),dataforseo,2,coloring pages to print out for free ; free coloring pages to print out
free coloring pages for free,90500,18,0.98,informational,Coloring — format (free/printable/pdf/online),dataforseo,1,free coloring pages for free
grown up coloring book pages,90500,9,1.5,informational,Coloring — format (free/printable/pdf/online),dataforseo,1,grown up coloring book pages
free coloring pages printouts,90500,17,1.13,informational,Coloring — format (free/printable/pdf/online),dataforseo,1,free coloring pages printouts
coloring pages free printing,90500,44,1.13,informational,Coloring — format (free/printable/pdf/online),dataforseo,2,coloring pages free printing ; free coloring printing pages
coloring book pages print,90500,6,1.04,transactional,Coloring — format (free/printable/pdf/online),dataforseo,2,coloring book pages print ; print coloring book pages
adult coloring pages for adults,90500,,1.5,informational,Coloring — audience (kids/adults/toddler),dataforseo,1,adult coloring pages for adults
coloring pages print,90500,24,0.92,informational,Coloring — format (free/printable/pdf/online),dataforseo,3,coloring pages print ; coloring pages to print ; coloring pages for print
coloring book printable pages,90500,7,1.69,transactional,Coloring — format (free/printable/pdf/online),dataforseo,5,coloring book printable pages ; coloring book pages printable ; book coloring pages printable ; printable coloring book page ; printable coloring book pages
free coloring printable coloring pages,90500,12,1.13,informational,Coloring — format (free/printable/pdf/online),dataforseo,1,free coloring printable coloring pages
free printable coloring book pages,90500,50,1.13,informational,Coloring — format (free/printable/pdf/online),dataforseo,1,free printable coloring book pages
coloring pages printouts,90500,21,1.1,informational,Coloring — format (free/printable/pdf/online),dataforseo,1,coloring pages printouts
free coloring coloring pages,90500,18,0.98,informational,Coloring — format (free/printable/pdf/online),dataforseo,1,free coloring coloring pages
online printable coloring pages,90500,68,1.1,informational,Coloring — format (free/printable/pdf/online),dataforseo,1,online printable coloring pages
cute easy drawing,90500,0,0.03,informational,Drawing ideas — by style/theme,dataforseo,7,cute easy drawing ; cute drawing easy ; easy cute drawing ; cute drawings easy ; cute and easy drawing ; cute drawing and easy
easy line drawing,90500,6,0.07,informational,Drawing/sketch — other,dataforseo,1,easy line drawing
how to draw a canine,90500,19,0.24,informational,How to draw / tutorials,dataforseo,1,how to draw a canine
how to draw doggo,90500,0,0.21,informational,Coloring — animals,dataforseo,2,how to draw doggo ; how to draw a doggo
how to draw a car,90500,0,0.1,informational,How to draw / tutorials,dataforseo,9,how to draw a car ; how to draw the car ; how to draw the cars ; how to draw on a car ; car how to draw ; cars how to draw
how to draw hello kitty,90500,2,0.26,informational,Coloring — licensed/characters,dataforseo,4,how to draw hello kitty ; how to draw a hello kitty ; how to draw the hello kitty ; hello kitty how to draw
how to draw a skull,90500,0,1.08,informational,How to draw / tutorials,dataforseo,3,how to draw a skull ; how to draw the skull ; skull how to draw
how to draw a fish,90500,0,0.06,informational,Coloring — animals,dataforseo,5,how to draw a fish ; how to draw the fish ; how to draw a fish and ; how to draw to fish ; fish how to draw
how to do draw a dog,90500,22,0.24,informational,Coloring — animals,dataforseo,1,how to do draw a dog
things to draw cute,90500,0,0.25,informational,Drawing ideas — by style/theme,dataforseo,7,things to draw cute ; how to draw cute things ; how to draw a cute things ; things to draw that are cute ; cute things to draw ; things cute to draw
coloring book print outs,90500,25,1.1,transactional,Coloring — format (free/printable/pdf/online),dataforseo,1,coloring book print outs
coloring book printable,90500,14,2.28,transactional,Coloring — format (free/printable/pdf/online),dataforseo,3,coloring book printable ; coloring book printables ; printable coloring book
free printable coloring book,90500,22,1.13,informational,Coloring — format (free/printable/pdf/online),dataforseo,5,free printable coloring book ; coloring book free printable ; coloring book printable free ; free coloring book printable ; free coloring book printables
coloring book free,90500,32,0.98,informational,Coloring — format (free/printable/pdf/online),dataforseo,1,coloring book free
coloring book printout,90500,19,1.1,transactional,Coloring — format (free/printable/pdf/online),dataforseo,2,coloring book printout ; coloring book printouts
coloring book pages hello kitty,74000,0,0.19,informational,Coloring — licensed/characters,dataforseo,3,coloring book pages hello kitty ; hello kitty coloring book page ; hello kitty coloring book pages
coloring pages hello kitty,74000,0,0.19,informational,Coloring — licensed/characters,dataforseo,7,coloring pages hello kitty ; coloring pages of hello kitty ; coloring pages for hello kitty ; hello kitty coloring pages ; kitty hello coloring pages ; coloring hello kitty pages
hello kitty print coloring pages,74000,0,0.19,informational,Coloring — licensed/characters,dataforseo,1,hello kitty print coloring pages
coloring book pages halloween,74000,0,0.08,informational,Coloring — seasonal/holiday,dataforseo,3,coloring book pages halloween ; coloring book pages for halloween ; halloween coloring book page
hello kitty coloring pages to color,74000,0,0.19,informational,Coloring — licensed/characters,dataforseo,1,hello kitty coloring pages to color
hello kitty characters coloring pages,74000,0,0.19,informational,Coloring — licensed/characters,dataforseo,1,hello kitty characters coloring pages
hello kitty printing coloring pages,74000,0,0.19,informational,Coloring — licensed/characters,dataforseo,1,hello kitty printing coloring pages
coloring pages halloween,74000,2,0.04,informational,Coloring — seasonal/holiday,dataforseo,9,coloring pages halloween ; coloring pages of halloween ; coloring pages on halloween ; coloring pages for halloween ; halloween coloring pages ; halloween pages coloring
hello kitty printable coloring pages,74000,0,0.19,informational,Coloring — licensed/characters,dataforseo,2,hello kitty printable coloring pages ; hello kitty printables coloring pages
how to draw a bird,74000,2,0.12,informational,Coloring — animals,dataforseo,8,how to draw a bird ; how to draw the bird ; how to draw the birds ; how to draw to birds ; bird how to draw ; birds how to draw
how to draw soccer ball,74000,3,0.05,informational,How to draw / tutorials,dataforseo,4,how to draw soccer ball ; how to draw soccer balls ; how to draw a soccer ball ; soccer ball how to draw
how to draw airplane,74000,0,0.05,informational,How to draw / tutorials,dataforseo,3,how to draw airplane ; how to draw the airplane ; airplane how to draw
how to draw fire,74000,0,0.15,informational,How to draw / tutorials,dataforseo,3,how to draw fire ; how to draw with fire ; fire how to draw
how to do draw a rose,74000,18,0.11,informational,Coloring — flowers/nature/food/vehicles,dataforseo,1,how to do draw a rose
how to draw a rose drawing,74000,12,0.11,informational,Coloring — flowers/nature/food/vehicles,dataforseo,1,how to draw a rose drawing
how to draw how to draw a rose,74000,0,0.11,informational,Coloring — flowers/nature/food/vehicles,dataforseo,1,how to draw how to draw a rose
things to draw easy,74000,0,0.1,informational,Drawing ideas — by style/theme,dataforseo,10,easy to draw things ; things to draw easy ; how to draw easy things ; how to draw a easy things ; things to draw that is easy ; things to draw that are easy
coloring book,74000,11,0.89,transactional,Coloring — format (free/printable/pdf/online),dataforseo,4,coloring book ; coloring books ; book coloring ; book: coloring
coloring book halloween,74000,0,0.17,informational,Coloring — seasonal/holiday,dataforseo,3,coloring book halloween ; coloring book for halloween ; halloween coloring book
coloring book hello kitty,74000,0,0.22,transactional,Coloring — licensed/characters,dataforseo,3,coloring book hello kitty ; coloring book of hello kitty ; hello kitty coloring book
coloring pages flower,60500,3,0.06,informational,Coloring — flowers/nature/food/vehicles,dataforseo,13,coloring pages flower ; coloring pages flowers ; coloring pages of flower ; coloring pages of flowers ; coloring pages for flowers ; coloring pages with flowers
coloring pages pokemon,60500,0,0.47,informational,Coloring — licensed/characters,dataforseo,6,coloring pages pokemon ; coloring pages of pokemon ; coloring pages for pokemon ; pokemon coloring pages ; coloring pokemon pages ; pokemon coloring in pages
coloring pages sonic,60500,0,0.11,informational,Coloring — licensed/characters,dataforseo,6,coloring pages sonic ; coloring pages of sonic ; coloring pages for sonic ; sonic coloring pages ; coloring sonic pages ; sonic coloring in pages
coloring pages sonic the hedgehog,60500,0,0.11,informational,Coloring — licensed/characters,dataforseo,4,coloring pages sonic the hedgehog ; coloring pages of sonic the hedgehog ; coloring pages for sonic the hedgehog ; sonic the hedgehog coloring pages
coloring book page flower,60500,0,0.06,informational,Coloring — format (free/printable/pdf/online),dataforseo,6,coloring book page flower ; coloring book pages flowers ; coloring book pages of flowers ; flower coloring book page ; flower coloring book pages ; flowers coloring book pages
coloring book pages pokemon,60500,0,0.47,informational,Coloring — licensed/characters,dataforseo,1,coloring book pages pokemon
coloring pages pokémon,60500,0,0.47,informational,Coloring — general/other,dataforseo,2,coloring pages pokémon ; coloring pages of pokémon
bluey coloring pages,60500,1,0.5,informational,Coloring — licensed/characters,dataforseo,1,bluey coloring pages
coloring pages about flowers,60500,6,0.06,informational,Coloring — flowers/nature/food/vehicles,dataforseo,1,coloring pages about flowers
coloring pages cute,60500,7,0.13,informational,Coloring — general/other,dataforseo,6,coloring pages cute ; coloring pages that are cute ; cute coloring pages ; cute coloring page ; coloring cute pages ; cute coloring in pages
adorable coloring pages,60500,7,0.14,informational,Coloring — general/other,dataforseo,1,adorable coloring pages
flower coloring pages to print,60500,1,0.06,informational,Coloring — format (free/printable/pdf/online),dataforseo,1,flower coloring pages to print
coloring pages floral,60500,2,0.06,informational,Coloring — flowers/nature/food/vehicles,dataforseo,1,coloring pages floral
how to drawing easy flower,60500,0,0.06,informational,Coloring — flowers/nature/food/vehicles,dataforseo,22,how to drawing easy flower ; how to drawing flower easy ; how to drawing a flower easy ; drawing easy flower ; drawing flower easy ; flower easy drawing
how to draw a frog,60500,0,0.06,informational,How to draw / tutorials,dataforseo,2,how to draw a frog ; frog how to draw
how to draw a cat cat,60500,4,0.12,informational,Coloring — animals,dataforseo,1,how to draw a cat cat
how to draw dragon,60500,0,0.16,informational,Coloring — unicorn/fairy/fantasy/princess,dataforseo,6,how to draw dragon ; how to draw dragons ; how to draw a dragon ; how to draw the dragon ; how to a draw a dragon ; how to to draw a dragon
how to draw cat,60500,0,0.14,informational,Coloring — animals,dataforseo,6,how to draw cat ; how to draw cats ; how to draw a cat ; how to draw the cat ; how how to draw a cat ; how to to draw a cat
how to draw volleyball,60500,0,0.04,informational,How to draw / tutorials,dataforseo,3,how to draw volleyball ; how to draw a volleyball ; volleyball how to draw
how to draw a house cat,60500,23,0.12,informational,Coloring — animals,dataforseo,1,how to draw a house cat
how to draw a dragon drawing,60500,1,0.17,informational,Coloring — unicorn/fairy/fantasy/princess,dataforseo,1,how to draw a dragon drawing
how to draw how to draw a dragon,60500,6,0.17,informational,Coloring — unicorn/fairy/fantasy/princess,dataforseo,1,how to draw how to draw a dragon
how to draw basketball,60500,0,0.05,informational,How to draw / tutorials,dataforseo,3,how to draw basketball ; how to draw a basketball ; basketball how to draw
how to draw a.dinosaur,60500,0,0.07,informational,Coloring — animals,dataforseo,4,how to draw a.dinosaur ; how to draw a dinosaur ; how to draw a dinosaurs ; dinosaurs how to draw
how to draw a snake,60500,0,0.04,informational,How to draw / tutorials,dataforseo,4,how to draw a snake ; how to draw the snake ; snake how to draw ; snakes how to draw
how to draw a cow,60500,0,0.04,informational,How to draw / tutorials,dataforseo,4,how to draw a cow ; how to draw the cow ; cow how to draw ; cows how to draw
how to draw a dragon dragon,60500,6,0.17,informational,Coloring — unicorn/fairy/fantasy/princess,dataforseo,1,how to draw a dragon dragon
coloring book for adults,60500,0,0.64,transactional,Coloring — audience (kids/adults/toddler),dataforseo,13,coloring book for adults ; coloring book adult ; coloring book adults ; coloring book for adult ; adult coloring book ; coloring for adults book
adult coloring book coloring books for adults,60500,30,0.64,transactional,Coloring — audience (kids/adults/toddler),dataforseo,1,adult coloring book coloring books for adults
adult coloring book for adults,60500,0,0.64,transactional,Coloring — audience (kids/adults/toddler),dataforseo,1,adult coloring book for adults
adult coloring book coloring book,60500,0,0.64,transactional,Coloring — format (free/printable/pdf/online),dataforseo,2,adult coloring book coloring book ; adult coloring book coloring books
adult colouring book coloring books,60500,,0.64,transactional,Coloring — format (free/printable/pdf/online),dataforseo,1,adult colouring book coloring books
adult coloring book books,60500,0,0.64,transactional,Coloring — format (free/printable/pdf/online),dataforseo,1,adult coloring book books
coloring pages unicorn,49500,0,0.09,informational,Coloring — unicorn/fairy/fantasy/princess,dataforseo,12,coloring pages unicorn ; coloring pages unicorns ; coloring pages of unicorn ; coloring pages of unicorns ; coloring pages for unicorn ; coloring pages for unicorns
print unicorn coloring pages,49500,0,0.09,transactional,Coloring — unicorn/fairy/fantasy/princess,dataforseo,4,unicorn print coloring pages ; print unicorn coloring pages ; unicorn coloring pages print ; unicorn coloring pages to print
coloring pages dinosaur,49500,1,0.1,informational,Coloring — animals,dataforseo,11,coloring pages dinosaur ; coloring pages dinosaurs ; coloring pages of dinosaur ; coloring pages of dinosaurs ; coloring pages for dinosaurs ; coloring pages with dinosaurs
coloring pages spiderman,49500,0,2.35,informational,Coloring — licensed/characters,dataforseo,4,coloring pages spiderman ; coloring pages for spiderman ; spiderman coloring pages ; spiderman coloring in pages
coloring pages summertime,49500,5,0.63,informational,Coloring — seasonal/holiday,dataforseo,2,coloring pages summertime ; summertime coloring pages
coloring book pages dinosaurs,49500,2,0.1,informational,Coloring — animals,dataforseo,1,coloring book pages dinosaurs
coloring pages summer,49500,15,0.63,informational,Coloring — seasonal/holiday,dataforseo,6,coloring pages summer ; coloring pages of summer ; coloring pages for summer ; coloring pages for the summer ; summer coloring pages ; coloring summer pages
stitch disney coloring pages,49500,0,0.05,informational,Coloring — licensed/characters,dataforseo,1,stitch disney coloring pages
coloring pages stitch,49500,0,0.05,informational,Coloring — licensed/characters,dataforseo,3,coloring pages stitch ; coloring pages of stitch ; stitch coloring pages
coloring pages spider-man,49500,0,2.35,informational,Coloring — licensed/characters,dataforseo,4,coloring pages spider-man ; coloring pages of spider man ; coloring pages for spider man ; spider man coloring pages
coloring book pages summer,49500,4,0.63,informational,Coloring — seasonal/holiday,dataforseo,2,coloring book pages summer ; summer coloring book pages
unicorn printable coloring pages,49500,0,0.13,transactional,Coloring — unicorn/fairy/fantasy/princess,dataforseo,4,unicorn printable coloring pages ; printable unicorn coloring pages ; unicorn coloring pages printable ; unicorn printables coloring pages
coloring pages of summer season,49500,15,0.63,informational,Coloring — seasonal/holiday,dataforseo,2,coloring pages of summer season ; summer season coloring pages
