keyword,search_volume,kd,cpc,intent,cluster,discovery,n_variants,variants
ocean animal coloring book,6600,0,0.26,informational,Coloring — animals,dataforseo,2,ocean animal coloring book ; ocean animals coloring book
elf coloring book pages,6600,7,0.06,informational,Coloring — format (free/printable/pdf/online),dataforseo,1,elf coloring book pages
cute printable coloring pages,6600,10,0.67,informational,Coloring — format (free/printable/pdf/online),dataforseo,3,cute printable coloring pages ; printable cute coloring pages ; printable cute coloring page
stitch coloring pages printable,6600,0,0.24,informational,Coloring — licensed/characters,dataforseo,1,stitch coloring pages printable
princess coloring pages printable,6600,2,0.15,informational,Coloring — unicorn/fairy/fantasy/princess,dataforseo,1,princess coloring pages printable
dinosaur coloring pages printable,6600,0,0.25,informational,Coloring — animals,dataforseo,1,dinosaur coloring pages printable
coloring online,6600,58,2.48,informational,Coloring — format (free/printable/pdf/online),dataforseo,1,coloring online
elephant coloring pages,6600,0,0.08,informational,Coloring — animals,dataforseo,1,elephant coloring pages
jesus coloring pages,6600,0,0.28,informational,Coloring — general/other,dataforseo,1,jesus coloring pages
mushroom coloring pages,6600,0,0.24,informational,Coloring — general/other,dataforseo,1,mushroom coloring pages
duck coloring pages,6600,0,0.08,informational,Coloring — general/other,dataforseo,1,duck coloring pages
ballerina coloring pages,6600,0,0.05,informational,Coloring — general/other,dataforseo,1,ballerina coloring pages
spring coloring sheets,6600,8,0.3,informational,Coloring — seasonal/holiday,dataforseo,1,spring coloring sheets
gingerbread house coloring page,6600,0,0.02,informational,Coloring — general/other,dataforseo,1,gingerbread house coloring page
cute pandas to draw,6600,0,0.02,informational,Coloring — animals,dataforseo,1,cute pandas to draw
elf coloring page,6600,0,0.06,informational,Coloring — general/other,dataforseo,1,elf coloring page
fun easy drawings to draw,6600,7,0.07,informational,Drawing ideas — by style/theme,dataforseo,1,fun easy drawings to draw
pumpkin outline printable,6600,15,0.04,informational,Coloring — seasonal/holiday,dataforseo,1,pumpkin outline printable
drawings for coloring,6600,31,0.43,informational,Coloring — general/other,dataforseo,1,drawings for coloring
elf coloring sheets,6600,1,0.06,informational,Coloring — format (free/printable/pdf/online),dataforseo,1,elf coloring sheets
coloring pages hello kitty and friends,6600,,0.16,,Coloring — licensed/characters,apify_autocomplete,1,coloring pages hello kitty and friends
cute drawings pinterest,6600,,0.02,,Drawing ideas — by style/theme,apify_autocomplete,1,cute drawings pinterest
free coloring pages pdf format,5400,15,2.98,informational,Coloring — format (free/printable/pdf/online),dataforseo,1,free coloring pages pdf format
simple pencil cute easy drawings,5400,5,0.05,informational,Drawing ideas — by style/theme,dataforseo,1,simple pencil cute easy drawings
how to draw a dog cute,5400,5,0.2,informational,Coloring — animals,dataforseo,1,how to draw a dog cute
cute simple drawing ideas,5400,0,0.12,informational,Drawing ideas — by style/theme,dataforseo,3,cute simple drawing ideas ; simple cute drawing ideas ; cute #simple drawing ideas
mermaid easy drawing,5400,1,0.02,informational,Coloring — unicorn/fairy/fantasy/princess,dataforseo,7,mermaid drawing easy ; mermaid easy drawing ; drawing easy mermaid ; easy mermaid drawing ; drawing of mermaid easy ; easy drawing of mermaid
easy sun drawing,5400,0,0.08,informational,Drawing/sketch — other,dataforseo,4,easy sun drawing ; sun drawing easy ; drawing easy sun ; easy drawing of the sun
easy food drawing,5400,0,0.03,informational,Coloring — flowers/nature/food/vehicles,dataforseo,5,easy food drawing ; food drawing easy ; foods drawing easy ; drawing of food easy ; easy drawing of food
summer drawing easy,5400,0,0.05,informational,Coloring — seasonal/holiday,dataforseo,2,summer drawing easy ; easy summer drawing
easy drawing disney,5400,6,0.02,informational,Coloring — licensed/characters,dataforseo,4,disney easy drawing ; disney drawing easy ; easy drawing disney ; easy disney drawing
picture to drawing easy,5400,2,0.04,informational,"Tool/feature (photo→coloring, generator, AI)",dataforseo,3,picture to drawing easy ; picture for drawing easy ; pictures for drawing easy
caterpillar easy drawing,5400,3,0.02,informational,Coloring — animals,dataforseo,1,caterpillar easy drawing
farmer drawing easy,5400,0,0.05,informational,Drawing/sketch — other,dataforseo,2,easy farmer drawing ; farmer drawing easy
drawing easy chicken,5400,0,0.03,informational,Drawing/sketch — other,dataforseo,7,drawing easy chicken ; chicken drawing easy ; easy chicken drawing ; easy drawing chicken ; chickens drawing easy ; easy drawing of chicken
easy drawing person,5400,0,,informational,Drawing ideas — by style/theme,dataforseo,3,easy person drawing ; easy drawing person ; easy drawing of a person
sunflower drawing easy,5400,0,0.03,informational,Coloring — flowers/nature/food/vehicles,dataforseo,5,sunflower drawing easy ; drawing sunflower easy ; sunflowers drawing easy ; drawing sunflowers easy ; easy drawing of a sunflower
cute animal drawing easy,5400,0,0.04,informational,Coloring — animals,dataforseo,7,cute animal drawing easy ; drawing cute animals easy ; easy drawing cute animals ; cute animals drawing easy ; easy cute animal drawings ; drawing cute easy animals
easy spongebob drawing,5400,0,,informational,Drawing/sketch — other,dataforseo,4,easy spongebob drawing ; easy drawing spongebob ; spongebob easy drawing ; easy drawing of spongebob
farming drawing easy,5400,0,0.05,informational,Drawing/sketch — other,dataforseo,1,farming drawing easy
leaf drawing easy,5400,0,0.03,informational,Drawing/sketch — other,dataforseo,2,leaf drawing easy ; drawing a leaf easy
palm tree drawing easy,5400,0,0.05,informational,Coloring — flowers/nature/food/vehicles,dataforseo,2,palm tree drawing easy ; palm trees drawing easy
city easy drawing,5400,0,,informational,Drawing ideas — by style/theme,dataforseo,4,city easy drawing ; city drawing easy ; easy city drawing ; easy drawing of a city
moonlight drawing easy,5400,0,0.02,informational,Drawing/sketch — other,dataforseo,1,moonlight drawing easy
mushroom drawing easy,5400,0,0.08,informational,Drawing/sketch — other,dataforseo,4,easy mushroom drawing ; mushroom drawing easy ; mushrooms drawing easy ; drawing mushrooms easy
church drawing easy,5400,0,0.04,informational,Drawing/sketch — other,dataforseo,4,church easy drawing ; easy church drawing ; church drawing easy ; easy drawing of a church
nose drawing easy,5400,0,0.02,informational,Drawing/sketch — other,dataforseo,5,easy nose drawing ; nose drawing easy ; noses drawing easy ; drawing of nose easy ; easy drawing of a nose
sunshine drawing easy,5400,0,0.08,informational,Drawing/sketch — other,dataforseo,1,sunshine drawing easy
easy harry potter drawing,5400,2,,informational,Drawing/sketch — other,dataforseo,5,harry potter drawing easy ; easy drawing harry potter ; harry potter easy drawing ; easy harry potter drawing ; easy drawing of harry potter
leaves drawing easy,5400,0,0.03,informational,Drawing/sketch — other,dataforseo,1,leaves drawing easy
easy wave drawing,5400,0,0.07,informational,Drawing/sketch — other,dataforseo,4,wave drawing easy ; easy wave drawing ; waves drawing easy ; drawing a wave easy
easy drawing crown,5400,0,0.02,informational,Drawing ideas — by style/theme,dataforseo,2,easy drawing crown ; crown drawing easy
easy drawing goku,5400,0,,informational,Drawing ideas — by style/theme,dataforseo,5,drawing goku easy ; easy drawing goku ; easy goku drawing ; goku drawing easy ; easy drawing of goku
easy landscaping drawing,5400,0,0.06,informational,Drawing/sketch — other,dataforseo,1,easy landscaping drawing
farmland drawing easy,5400,0,0.05,informational,Drawing/sketch — other,dataforseo,1,farmland drawing easy
jellyfish drawing easy,5400,0,0.04,informational,Drawing/sketch — other,dataforseo,1,jellyfish drawing easy
easy drawing ghost,5400,0,0.04,informational,Drawing ideas — by style/theme,dataforseo,5,easy drawing ghost ; ghost drawing easy ; drawing ghost easy ; easy ghost drawing ; ghosts drawing easy
easy hen drawing,5400,0,0.03,informational,Drawing/sketch — other,dataforseo,1,easy hen drawing
easy easter drawing,5400,0,0.03,informational,Coloring — seasonal/holiday,dataforseo,2,easy easter drawing ; easter drawing easy
drawing easy moon,5400,0,0.02,informational,Drawing/sketch — other,dataforseo,4,easy moon drawing ; moon drawing easy ; drawing easy moon ; easy drawing of the moon
easy drawing squirrel,5400,0,0.03,informational,Drawing ideas — by style/theme,dataforseo,6,easy squirrel drawing ; easy drawing squirrel ; squirrel drawing easy ; squirrels drawing easy ; easy drawing of squirrel ; easy drawing of a squirrel
chick drawing easy,5400,0,0.03,informational,Drawing/sketch — other,dataforseo,2,chick drawing easy ; easy drawing of chick
beehive drawing easy,5400,0,0.05,informational,Drawing/sketch — other,dataforseo,1,beehive drawing easy
gojo drawing easy,5400,0,,informational,Drawing/sketch — other,dataforseo,1,gojo drawing easy
easy farm drawing,5400,0,0.05,informational,Drawing/sketch — other,dataforseo,3,easy farm drawing ; easy drawing farm ; farm drawing easy
bee drawing easy,5400,0,0.05,informational,Drawing/sketch — other,dataforseo,2,bee drawing easy ; bees drawing easy
cake drawing easy,5400,0,0.02,informational,Drawing/sketch — other,dataforseo,3,easy cake drawing ; cake drawing easy ; cakes drawing easy
easy landscape drawing,5400,0,0.47,informational,Drawing/sketch — other,dataforseo,2,easy landscape drawing ; landscape drawing easy
sun flower drawing easy,5400,0,0.03,informational,Coloring — flowers/nature/food/vehicles,dataforseo,1,sun flower drawing easy
cities drawing easy,5400,0,,informational,Drawing/sketch — other,dataforseo,1,cities drawing easy
jelly fish drawing easy,5400,0,0.04,informational,Coloring — animals,dataforseo,1,jelly fish drawing easy
drawing flowers step by step easy,5400,1,0.23,informational,Coloring — flowers/nature/food/vehicles,dataforseo,1,drawing flowers step by step easy
sunlight drawing easy,5400,0,0.08,informational,Drawing/sketch — other,dataforseo,1,sunlight drawing easy
how to draw hair anime,5400,0,,informational,How to draw / tutorials,dataforseo,1,how to draw hair anime
things to do draw,5400,0,0.13,informational,Drawing/sketch — other,dataforseo,1,things to do draw
draw things to draw,5400,10,0.13,informational,Drawing ideas — by style/theme,dataforseo,1,draw things to draw
things to draw for xmas,5400,0,0.02,informational,Drawing ideas — by style/theme,dataforseo,2,how to draw xmas things ; things to draw for xmas
things to draw scary,5400,0,,informational,Drawing ideas — by style/theme,dataforseo,3,things to draw scary ; how to draw scary things ; scary things to draw
christmassy things to draw,5400,0,0.02,informational,Coloring — seasonal/holiday,dataforseo,1,christmassy things to draw
things to draw christmas,5400,0,0.02,informational,Coloring — seasonal/holiday,dataforseo,8,things to draw christmas ; things to draw at christmas ; things to draw for christmas ; how to draw christmas things ; how to draw a christmas things ; how to draw things of christmas
coloring book pages ocean,5400,0,0.44,informational,Coloring — format (free/printable/pdf/online),dataforseo,2,coloring book pages ocean ; ocean coloring book pages
cozy friend coloring book,5400,0,0.19,transactional,Coloring — format (free/printable/pdf/online),dataforseo,2,cozy friend coloring book ; cozy friends coloring book
stress relief coloring book,5400,0,0.24,informational,Coloring — format (free/printable/pdf/online),dataforseo,2,stress relief coloring book ; stress relief: coloring book
coloring book cinderella,5400,0,0.28,informational,Coloring — format (free/printable/pdf/online),dataforseo,2,coloring book cinderella ; cinderella coloring book
hello kitty coloring book printable,5400,0,0.5,transactional,Coloring — licensed/characters,dataforseo,1,hello kitty coloring book printable
how to train your dragon coloring book pages,5400,0,0.18,transactional,Coloring — unicorn/fairy/fantasy/princess,dataforseo,1,how to train your dragon coloring book pages
coloring book free pdf,5400,13,2.98,informational,Coloring — format (free/printable/pdf/online),dataforseo,4,coloring book pdf free ; coloring book free pdf ; free pdf coloring book ; free coloring book pdf
pokemon coloring book printable,5400,0,1.51,transactional,Coloring — licensed/characters,dataforseo,2,printable pokemon coloring book ; pokemon coloring book printable
free easter coloring book pages,5400,2,0.37,informational,Coloring — seasonal/holiday,dataforseo,1,free easter coloring book pages
giraffe coloring book page,5400,0,0.08,informational,Coloring — format (free/printable/pdf/online),dataforseo,2,giraffe coloring book page ; giraffe coloring book pages
dolphin coloring book page,5400,0,0.22,informational,Coloring — format (free/printable/pdf/online),dataforseo,2,dolphin coloring book page ; dolphin coloring book pages
nature coloring book pages,5400,0,2.95,informational,Coloring — format (free/printable/pdf/online),dataforseo,1,nature coloring book pages
coloring book page fish,5400,0,0.07,informational,Coloring — animals,dataforseo,4,coloring book page fish ; coloring book pages of fish ; fish coloring book page ; fish coloring book pages
coloring book pages of owls,5400,0,0.08,informational,Coloring — animals,dataforseo,1,coloring book pages of owls
coloring book american flag,5400,0,0.11,transactional,Coloring — format (free/printable/pdf/online),dataforseo,2,coloring book american flag ; american flag coloring book
holiday coloring book pages,5400,9,1.4,informational,Coloring — seasonal/holiday,dataforseo,1,holiday coloring book pages
adult coloring book pages flowers,5400,2,0.11,informational,Coloring — format (free/printable/pdf/online),dataforseo,1,adult coloring book pages flowers
batman coloring book page,5400,0,,informational,Coloring — format (free/printable/pdf/online),dataforseo,2,batman coloring book page ; batman coloring book pages
coloring book gingerbread man,5400,0,0.05,informational,Coloring — format (free/printable/pdf/online),dataforseo,1,coloring book gingerbread man
cinderella coloring book page,5400,4,0.28,informational,Coloring — format (free/printable/pdf/online),dataforseo,2,cinderella coloring book page ; cinderella coloring book pages
deer coloring book pages,5400,0,0.19,informational,Coloring — format (free/printable/pdf/online),dataforseo,1,deer coloring book pages
hello kitty christmas coloring book,5400,0,,transactional,Coloring — licensed/characters,dataforseo,1,hello kitty christmas coloring book
coloring book amazon,5400,6,0.76,transactional,Coloring — format (free/printable/pdf/online),dataforseo,2,coloring book amazon ; amazon coloring book
coloring book fire truck,5400,0,0.26,transactional,Coloring — format (free/printable/pdf/online),dataforseo,2,coloring book fire truck ; fire truck coloring book
baseball coloring book pages,5400,0,0.37,informational,Coloring — format (free/printable/pdf/online),dataforseo,1,baseball coloring book pages
coloring book giraffe,5400,0,0.08,informational,Coloring — format (free/printable/pdf/online),dataforseo,1,coloring book giraffe
coloring book deer,5400,0,0.19,informational,Coloring — format (free/printable/pdf/online),dataforseo,1,coloring book deer
marvel coloring book pages,5400,0,0.21,informational,Coloring — format (free/printable/pdf/online),dataforseo,1,marvel coloring book pages
free easter coloring book,5400,0,0.37,informational,Coloring — seasonal/holiday,dataforseo,1,free easter coloring book
lisa frank coloring book pages,5400,0,0.31,informational,Coloring — format (free/printable/pdf/online),dataforseo,1,lisa frank coloring book pages
coloring book solar system,5400,0,0.27,informational,Coloring — format (free/printable/pdf/online),dataforseo,1,coloring book solar system
powerpuff coloring book,5400,0,0.08,transactional,Coloring — format (free/printable/pdf/online),dataforseo,1,powerpuff coloring book
christmas coloring book pages for adults,5400,0,4.62,transactional,Coloring — seasonal/holiday,dataforseo,1,christmas coloring book pages for adults
crayola free printable coloring pages,5400,30,0.02,informational,Coloring — format (free/printable/pdf/online),dataforseo,1,crayola free printable coloring pages
january coloring pages,5400,0,,informational,Coloring — general/other,dataforseo,1,january coloring pages
donut coloring pages,5400,0,0.15,informational,Coloring — general/other,dataforseo,2,donut coloring pages ; donut coloring page
unicorn coloring sheet,5400,0,0.12,informational,Coloring — unicorn/fairy/fantasy/princess,dataforseo,1,unicorn coloring sheet
doughnut coloring pages,5400,0,0.15,informational,Coloring — general/other,dataforseo,1,doughnut coloring pages
easter coloring sheets,5400,0,0.08,informational,Coloring — seasonal/holiday,dataforseo,1,easter coloring sheets
gingerbread man coloring page,5400,0,0.05,informational,Coloring — general/other,dataforseo,1,gingerbread man coloring page
snowflake coloring page,5400,0,0.02,informational,Coloring — general/other,dataforseo,1,snowflake coloring page
cute turtles to draw,5400,3,0.03,informational,Coloring — animals,dataforseo,1,cute turtles to draw
ghost coloring page,5400,0,0.07,informational,Coloring — general/other,dataforseo,1,ghost coloring page
kindergarten worksheets printable,5400,30,1.85,informational,Coloring — audience (kids/adults/toddler),dataforseo,1,kindergarten worksheets printable
cool pictures to draw,5400,0,0.06,informational,Drawing/sketch — other,dataforseo,1,cool pictures to draw
coloring pages free pdf,5400,,2.98,,Coloring — format (free/printable/pdf/online),apify_autocomplete,1,coloring pages free pdf
coloring pages insects,5400,,0.23,,Coloring — animals,apify_autocomplete,1,coloring pages insects
coloring pages nature,5400,,2.95,,Coloring — flowers/nature/food/vehicles,apify_autocomplete,1,coloring pages nature
coloring pages to print out,5400,,0.98,,Coloring — format (free/printable/pdf/online),apify_autocomplete,1,coloring pages to print out
how to draw feet,5400,,,,How to draw / tutorials,apify_autocomplete,1,how to draw feet
how to draw four leaf clover,5400,,0.02,,How to draw / tutorials,apify_autocomplete,1,how to draw four leaf clover
how to draw toothless,5400,,,,How to draw / tutorials,apify_autocomplete,1,how to draw toothless
coloring pages for adults easy,4400,0,0.49,informational,Coloring — audience (kids/adults/toddler),dataforseo,2,coloring pages for adults easy ; easy coloring pages for adults
crayola unicorn coloring pages,4400,4,0.7,transactional,Coloring — unicorn/fairy/fantasy/princess,dataforseo,1,crayola unicorn coloring pages
drawing room interior design ideas,4400,21,1.32,informational,Drawing/sketch — other,dataforseo,4,drawing room interior design ideas ; interior design drawing room ideas ; interior design of drawing room ideas ; interior design ideas for drawing room
drawing ideas pen,4400,0,0.28,informational,Drawing ideas — by style/theme,dataforseo,3,drawing ideas pen ; drawing ideas in pen ; pen drawing ideas
drawing room ideas interior,4400,53,1.32,informational,Drawing/sketch — other,dataforseo,1,drawing room ideas interior
interior decoration ideas for drawing room,4400,1,1.32,informational,Drawing/sketch — other,dataforseo,1,interior decoration ideas for drawing room
pen ink drawing ideas,4400,0,0.36,informational,Drawing ideas — by style/theme,dataforseo,3,ink pen drawing ideas ; pen ink drawing ideas ; pen and ink drawing ideas
drawing ideas aesthetic,4400,0,,informational,Drawing ideas — by style/theme,dataforseo,2,drawing ideas aesthetic ; aesthetic drawing ideas
interior designing ideas for drawing room,4400,17,1.32,informational,Drawing/sketch — other,dataforseo,1,interior designing ideas for drawing room
drawing ideas pencil,4400,0,0.24,informational,Drawing ideas — by style/theme,dataforseo,8,drawing ideas pencil ; drawing ideas in pencil ; drawing ideas with pencil ; pencil drawing ideas ; ideas pencil drawing ; drawing pencil ideas
drawing easy tutorials,4400,42,1.41,informational,Drawing/sketch — other,dataforseo,3,easy tutorials drawing ; drawing easy tutorials ; easy tutorials for drawing
easy truck drawing,4400,2,0.11,informational,Coloring — flowers/nature/food/vehicles,dataforseo,2,easy truck drawing ; easy drawing of truck
drawing ocean easy,4400,0,0.03,informational,Drawing/sketch — other,dataforseo,2,easy ocean drawing ; drawing ocean easy
sheep drawing easy,4400,2,0.03,informational,Drawing/sketch — other,dataforseo,1,sheep drawing easy
loving drawing easy,4400,0,0.02,informational,Drawing/sketch — other,dataforseo,1,loving drawing easy
lungs drawing easy,4400,0,0.1,informational,Drawing/sketch — other,dataforseo,1,lungs drawing easy
hairstyles drawing easy,4400,0,,informational,Drawing/sketch — other,dataforseo,2,hairstyles drawing easy ; easy hairstyles drawing
easy drawing hand,4400,0,0.1,informational,Drawing ideas — by style/theme,dataforseo,3,easy drawing hand ; hands drawing easy ; easy drawing of hand
love drawing easy,4400,0,0.02,informational,Drawing/sketch — other,dataforseo,1,love drawing easy
drawing easy mickey mouse,4400,2,0.06,informational,Drawing/sketch — other,dataforseo,1,drawing easy mickey mouse
easy jaguar drawing,4400,0,0.03,informational,Drawing/sketch — other,dataforseo,1,easy jaguar drawing
easy cheetah drawing,4400,2,0.03,informational,Drawing/sketch — other,dataforseo,1,easy cheetah drawing
easy seashell drawing,4400,0,0.03,informational,Drawing/sketch — other,dataforseo,2,easy seashell drawing ; seashells drawing easy
hibiscus drawing easy,4400,0,0.03,informational,Drawing/sketch — other,dataforseo,1,hibiscus drawing easy
fall drawing easy,4400,0,0.16,informational,Coloring — seasonal/holiday,dataforseo,1,fall drawing easy
teddy bear drawing easy,4400,0,0.03,informational,Coloring — animals,dataforseo,1,teddy bear drawing easy
easy body drawing base,4400,2,,informational,Drawing/sketch — other,dataforseo,1,easy body drawing base
easy shell drawing,4400,0,0.03,informational,Drawing/sketch — other,dataforseo,3,shell drawing easy ; easy shell drawing ; shells drawing easy
dove drawing easy,4400,0,0.03,informational,Drawing/sketch — other,dataforseo,2,dove drawing easy ; doves drawing easy
cross drawing easy,4400,0,0.02,informational,Drawing/sketch — other,dataforseo,1,cross drawing easy
lips drawing easy,4400,0,0.02,informational,Drawing/sketch — other,dataforseo,2,lips drawing easy ; drawing of lips easy
snowman drawing easy,4400,1,0.02,informational,Coloring — seasonal/holiday,dataforseo,1,snowman drawing easy
mickey drawing easy,4400,0,0.06,informational,Drawing/sketch — other,dataforseo,1,mickey drawing easy
easy drawing of earth,4400,0,0.04,informational,Drawing ideas — by style/theme,dataforseo,1,easy drawing of earth
giraffe drawing easy,4400,0,0.03,informational,Drawing/sketch — other,dataforseo,1,giraffe drawing easy
easy drawing of minion,4400,1,0.12,informational,Drawing ideas — by style/theme,dataforseo,1,easy drawing of minion
easy drawing of a train,4400,0,0.05,informational,Drawing ideas — by style/theme,dataforseo,1,easy drawing of a train
flower drawing easy and beautiful,4400,0,0.06,informational,Coloring — flowers/nature/food/vehicles,dataforseo,1,flower drawing easy and beautiful
sketch cool things to draw,4400,5,0.02,informational,Drawing ideas — by style/theme,dataforseo,1,sketch cool things to draw
small cute things to draw,4400,0,0.08,informational,Drawing ideas — by style/theme,dataforseo,3,small cute things to draw ; cute small things to draw ; cute things to draw small
good things to draw,4400,2,2.97,informational,Drawing ideas — by style/theme,dataforseo,1,good things to draw
best things to draw,4400,0,2.97,informational,Drawing ideas — by style/theme,dataforseo,1,best things to draw
things to draw when bored cute,4400,0,0.03,informational,Drawing ideas — by style/theme,dataforseo,3,things to draw when bored cute ; cute things to draw when bored ; cute things to draw when your bored
how to draw adorable things,4400,0,0.42,informational,How to draw / tutorials,dataforseo,2,how to draw adorable things ; adorable things to draw
great things to draw,4400,0,2.97,informational,Drawing ideas — by style/theme,dataforseo,1,great things to draw
coloring book free online,4400,44,2.72,informational,Coloring — format (free/printable/pdf/online),dataforseo,7,coloring book online free ; coloring book free online ; coloring book online for free ; free coloring book online ; online free coloring book ; free online coloring book
coloring book animals printable,4400,4,0.87,informational,Coloring — animals,dataforseo,4,coloring book animals printable ; coloring book: animals printable ; animal coloring book printable ; animals coloring book printable
personalised coloring book,4400,0,2.79,transactional,Coloring — format (free/printable/pdf/online),dataforseo,1,personalised coloring book
coloring book personalized,4400,0,2.79,transactional,Coloring — format (free/printable/pdf/online),dataforseo,2,coloring book personalized ; personalized coloring book
