keyword,search_volume,kd,cpc,intent,cluster,discovery,n_variants,variants
cool things to draw step by step,590,26,0.01,informational,Drawing ideas — by style/theme,dataforseo,1,cool things to draw step by step
unicorn coloring pages printable pdf,590,0,0.63,transactional,Coloring — unicorn/fairy/fantasy/princess,dataforseo,1,unicorn coloring pages printable pdf
easy stranger things drawing ideas,590,0,,informational,Drawing ideas — by style/theme,dataforseo,1,easy stranger things drawing ideas
horror drawing ideas,590,0,,informational,Drawing ideas — by style/theme,dataforseo,1,horror drawing ideas
drawing challenge ideas,590,0,17.44,informational,Drawing/sketch — other,dataforseo,2,drawing challenge ideas ; drawing challenges ideas
challenging drawing ideas,590,0,17.44,informational,Drawing ideas — by style/theme,dataforseo,1,challenging drawing ideas
drawing ideas pinterest easy,590,0,,informational,Drawing ideas — by style/theme,dataforseo,3,drawing ideas pinterest easy ; pinterest drawing ideas easy ; easy pinterest drawing ideas
drawing ideas easy step by step,590,6,0.13,informational,Drawing ideas — by style/theme,dataforseo,5,drawing ideas easy step by step ; drawing ideas step by step easy ; step by step easy drawing ideas ; easy drawing ideas step by step ; easy step by step drawing ideas
monster drawing ideas,590,0,0.01,informational,Drawing ideas — by style/theme,dataforseo,2,monster drawing ideas ; ideas for drawing monsters
ugly sweater drawing ideas,590,0,,informational,Drawing ideas — by style/theme,dataforseo,2,ugly sweater drawing ideas ; ugly sweater ideas drawing
alt drawing ideas,590,0,,informational,Drawing ideas — by style/theme,dataforseo,1,alt drawing ideas
drawing ideas cards,590,0,,informational,Drawing ideas — by style/theme,dataforseo,4,drawing ideas cards ; drawing ideas for cards ; card drawing ideas ; cards drawing ideas
drawing ideas chicano,590,0,,informational,Drawing ideas — by style/theme,dataforseo,2,drawing ideas chicano ; chicano drawing ideas
1 point perspective drawing ideas,590,8,,informational,Drawing ideas — by style/theme,dataforseo,1,1 point perspective drawing ideas
surreal drawing ideas,590,0,,informational,Drawing ideas — by style/theme,dataforseo,1,surreal drawing ideas
drawing ideas for posters,590,0,0.01,informational,Drawing ideas — by style/theme,dataforseo,4,drawing ideas for posters ; poster drawing ideas ; poster ideas drawing ; drawing poster ideas
dress drawing ideas,590,7,0.13,informational,Drawing ideas — by style/theme,dataforseo,2,dress drawing ideas ; dress ideas drawing
strange drawing ideas,590,0,,informational,Drawing ideas — by style/theme,dataforseo,1,strange drawing ideas
drawing ideas for bookmarks,590,0,0.08,informational,Coloring — format (free/printable/pdf/online),dataforseo,4,drawing ideas for bookmarks ; bookmark drawing ideas ; bookmarks drawing ideas ; bookmark ideas drawing
surrealism drawing ideas,590,0,,informational,Drawing ideas — by style/theme,dataforseo,2,surrealism drawing ideas ; ideas for surrealism drawing
drawing ideas easy kawaii,590,0,,informational,Drawing ideas — by style/theme,dataforseo,1,drawing ideas easy kawaii
drawing ideas for adults,590,0,0.32,informational,Coloring — audience (kids/adults/toddler),dataforseo,3,drawing ideas for adults ; drawing ideas adults ; adult drawing ideas
drippy drawing ideas,590,0,,informational,Drawing ideas — by style/theme,dataforseo,1,drippy drawing ideas
drawing ideas hard,590,0,,informational,Drawing ideas — by style/theme,dataforseo,2,drawing ideas hard ; hard drawing ideas
couple drawing ideas,590,0,0.03,informational,Drawing ideas — by style/theme,dataforseo,2,couple drawing ideas ; couples drawing ideas
drawing cute dragon puppet ideas,590,0,,informational,Coloring — unicorn/fairy/fantasy/princess,dataforseo,1,drawing cute dragon puppet ideas
little drawing ideas,590,0,0.01,informational,Drawing ideas — by style/theme,dataforseo,1,little drawing ideas
border drawing ideas,590,0,0.03,informational,Drawing ideas — by style/theme,dataforseo,2,border drawing ideas ; drawing border ideas
christian drawing ideas,590,0,0.05,informational,Drawing ideas — by style/theme,dataforseo,1,christian drawing ideas
circular drawing ideas,590,0,,informational,Drawing ideas — by style/theme,dataforseo,1,circular drawing ideas
music drawing ideas,590,0,,informational,Drawing ideas — by style/theme,dataforseo,1,music drawing ideas
drawing ideas nature,590,0,,informational,Coloring — flowers/nature/food/vehicles,dataforseo,4,drawing ideas nature ; drawing ideas of nature ; drawing ideas for nature ; nature drawing ideas
one point perspective drawing ideas,590,13,,informational,Drawing ideas — by style/theme,dataforseo,1,one point perspective drawing ideas
weird drawing ideas,590,0,,informational,Drawing ideas — by style/theme,dataforseo,1,weird drawing ideas
veteran day drawing ideas,590,0,,informational,Drawing ideas — by style/theme,dataforseo,2,veteran day drawing ideas ; veterans day drawing ideas
color wheel drawing ideas,590,0,,informational,Drawing ideas — by style/theme,dataforseo,1,color wheel drawing ideas
weirdcore drawing ideas,590,0,,informational,Drawing ideas — by style/theme,dataforseo,1,weirdcore drawing ideas
drip drawing ideas,590,0,,informational,Drawing ideas — by style/theme,dataforseo,1,drip drawing ideas
drawing ideas disney,590,0,,informational,Coloring — licensed/characters,dataforseo,2,drawing ideas disney ; disney drawing ideas
circle drawing ideas,590,0,,informational,Drawing ideas — by style/theme,dataforseo,1,circle drawing ideas
things to draw y2k,590,0,,informational,Drawing ideas — by style/theme,dataforseo,2,things to draw y2k ; y2k things to draw
things to draw animals,590,3,0.02,informational,Coloring — animals,dataforseo,1,things to draw animals
things to draw on birthday cards,590,0,0.04,informational,Drawing ideas — by style/theme,dataforseo,5,things to draw on birthday cards ; things to draw for birthday cards ; things to draw in a birthday card ; things to draw on a birthday card ; things to draw for a birthday card
things to draw for teachers,590,0,0.01,informational,Drawing ideas — by style/theme,dataforseo,3,things to draw for teachers ; things to draw for a teacher ; things to draw for your teacher
easy doodles things to draw on your hand,590,0,,informational,Drawing ideas — by style/theme,dataforseo,1,easy doodles things to draw on your hand
easy art things to draw when bored,590,0,,informational,Drawing ideas — by style/theme,dataforseo,1,easy art things to draw when bored
fun cool things to draw,590,0,,informational,Drawing ideas — by style/theme,dataforseo,2,fun cool things to draw ; fun and cool things to draw
how to draw will from stranger things,590,0,,informational,How to draw / tutorials,dataforseo,1,how to draw will from stranger things
easy random things to draw,590,0,,informational,Drawing ideas — by style/theme,dataforseo,3,random things to draw easy ; random easy things to draw ; easy random things to draw
easy small things to draw,590,0,0.02,informational,Drawing ideas — by style/theme,dataforseo,3,small things to draw easy ; easy small things to draw ; small easy things to draw
how to draw easter things,590,0,0.04,informational,Coloring — seasonal/holiday,dataforseo,4,things to draw for easter ; how to draw easter things ; how to draw things for easter ; easter things to draw
things to draw on your hand with pen easy,590,0,,informational,Drawing ideas — by style/theme,dataforseo,1,things to draw on your hand with pen easy
things to draw girly,590,0,0.04,informational,Drawing ideas — by style/theme,dataforseo,2,things to draw girly ; girly things to draw
random cute things to draw animals,590,4,0.02,informational,Coloring — animals,dataforseo,1,random cute things to draw animals
things to draw emo,590,0,,informational,Drawing ideas — by style/theme,dataforseo,2,things to draw emo ; emo things to draw
things to draw generator,590,8,,informational,"Tool/feature (photo→coloring, generator, AI)",dataforseo,1,things to draw generator
things to draw sketches,590,0,,informational,Drawing ideas — by style/theme,dataforseo,1,things to draw sketches
cute things to draw for valentine's day,590,0,,informational,Coloring — seasonal/holiday,dataforseo,1,cute things to draw for valentine's day
pretty cute things to draw,590,0,0.03,informational,Drawing ideas — by style/theme,dataforseo,1,pretty cute things to draw
things to draw on procreate,590,0,,informational,Drawing ideas — by style/theme,dataforseo,2,things to draw in procreate ; things to draw on procreate
easy to draw christmas things,590,0,,informational,Coloring — seasonal/holiday,dataforseo,6,easy to draw christmas things ; christmas things easy to draw ; easy things to draw christmas ; easy christmas things to draw ; christmas things to draw easy ; easy things to draw for christmas
trippy things to draw,590,0,,informational,Drawing ideas — by style/theme,dataforseo,1,trippy things to draw
how to draw science things,590,0,,informational,How to draw / tutorials,dataforseo,2,how to draw science things ; science things to draw
easy creepy things to draw,590,0,,informational,Drawing ideas — by style/theme,dataforseo,1,easy creepy things to draw
pink things to draw,590,0,,informational,Drawing ideas — by style/theme,dataforseo,1,pink things to draw
awesome things to draw step by step,590,6,0.01,informational,Drawing ideas — by style/theme,dataforseo,1,awesome things to draw step by step
things to draw sketchbook,590,0,0.9,informational,Coloring — format (free/printable/pdf/online),dataforseo,4,things to draw sketchbook ; things to draw in sketchbook ; things to draw in a sketchbook ; things to draw in your sketchbook
how to draw dustin from stranger things,590,0,,informational,How to draw / tutorials,dataforseo,1,how to draw dustin from stranger things
google doodle ideas,590,10,,informational,Drawing ideas — by style/theme,dataforseo,5,google doodle ideas ; doodle google ideas ; doodle for google ideas ; ideas for google doodle ; ideas for doodle for google
kuromi printable coloring pages,590,0,,informational,Coloring — licensed/characters,dataforseo,2,kuromi printable coloring pages ; kuromi coloring pages printable
monkey printable coloring pages,590,0,0.15,informational,Coloring — format (free/printable/pdf/online),dataforseo,2,monkey printable coloring pages ; monkey coloring pages printable
frog coloring pages printable,590,0,0.62,informational,Coloring — format (free/printable/pdf/online),dataforseo,1,frog coloring pages printable
easy drawing coloring pages,590,6,0.04,informational,Drawing ideas — by style/theme,dataforseo,2,easy drawing coloring pages ; easy drawings coloring pages
lion coloring pages printable,590,0,0.03,informational,Coloring — animals,dataforseo,1,lion coloring pages printable
ocean coloring pages printable,590,0,0.95,informational,Coloring — format (free/printable/pdf/online),dataforseo,1,ocean coloring pages printable
elephant coloring pages printable,590,0,0.03,informational,Coloring — animals,dataforseo,1,elephant coloring pages printable
november coloring pages printable,590,0,,informational,Coloring — format (free/printable/pdf/online),dataforseo,1,november coloring pages printable
cow coloring pages printable,590,0,0.05,informational,Coloring — format (free/printable/pdf/online),dataforseo,1,cow coloring pages printable
psychedelic coloring pages,590,0,0.29,informational,Coloring — general/other,dataforseo,1,psychedelic coloring pages
house printable coloring pages,590,0,0.62,informational,Coloring — format (free/printable/pdf/online),dataforseo,1,house printable coloring pages
bendy coloring pages,590,0,,informational,Coloring — general/other,dataforseo,1,bendy coloring pages
earth day coloring pages printable,590,0,0.62,informational,Coloring — format (free/printable/pdf/online),dataforseo,1,earth day coloring pages printable
duck coloring pages printable,590,0,0.02,informational,Coloring — format (free/printable/pdf/online),dataforseo,2,duck coloring pages printable ; ducks coloring pages printable
fox coloring pages printable,590,0,0.03,informational,Coloring — animals,dataforseo,1,fox coloring pages printable
lent coloring pages,590,0,0.08,informational,Coloring — general/other,dataforseo,1,lent coloring pages
rumi printable coloring pages,590,0,,informational,Coloring — format (free/printable/pdf/online),dataforseo,1,rumi printable coloring pages
printable coloring pages transformers,590,0,,informational,Coloring — licensed/characters,dataforseo,5,printable coloring pages transformers ; transformer printable coloring pages ; printable transformer coloring pages ; transformer coloring pages printable ; printable transformers coloring pages
sword coloring pages,590,0,,informational,Coloring — general/other,dataforseo,1,sword coloring pages
giant coloring pages,590,0,0.49,transactional,Coloring — general/other,dataforseo,1,giant coloring pages
simple mandala coloring pages,590,11,0.12,informational,Coloring — flowers/nature/food/vehicles,dataforseo,1,simple mandala coloring pages
dog drawing printable,590,0,0.23,transactional,Coloring — animals,dataforseo,1,dog drawing printable
owl coloring pages printable,590,0,0.05,informational,Coloring — animals,dataforseo,1,owl coloring pages printable
diy coloring book,590,0,0.9,transactional,Coloring — format (free/printable/pdf/online),dataforseo,1,diy coloring book
mcqueen coloring pages printable,590,0,0.04,navigational,Coloring — format (free/printable/pdf/online),dataforseo,1,mcqueen coloring pages printable
beach coloring pages for adults,590,0,0.18,informational,Coloring — audience (kids/adults/toddler),dataforseo,1,beach coloring pages for adults
mummy coloring pages,590,0,,informational,Coloring — general/other,dataforseo,1,mummy coloring pages
mystery coloring pages,590,0,0.68,informational,Coloring — general/other,dataforseo,1,mystery coloring pages
coloring pages grandma,590,0,0.55,informational,Coloring — general/other,dataforseo,1,coloring pages grandma
scripture coloring pages,590,0,0.14,informational,Coloring — general/other,dataforseo,1,scripture coloring pages
coloring book ideas,590,,0.4,,Coloring — format (free/printable/pdf/online),apify_autocomplete,1,coloring book ideas
coloring pages 3d,590,,0.74,,Coloring — general/other,apify_autocomplete,1,coloring pages 3d
coloring pages ideas,590,,0.4,,Coloring — general/other,apify_autocomplete,1,coloring pages ideas
coloring pages only,590,,4.53,,Coloring — general/other,apify_autocomplete,1,coloring pages only
cute drawing hard,590,,0.02,,Drawing ideas — by style/theme,apify_autocomplete,1,cute drawing hard
cute drawing to trace,590,,0.02,,Drawing ideas — by style/theme,apify_autocomplete,1,cute drawing to trace
easy drawing videos,590,,,,Drawing ideas — by style/theme,apify_autocomplete,1,easy drawing videos
how to draw judy hopps,590,,0.02,,How to draw / tutorials,apify_autocomplete,1,how to draw judy hopps
unicorn mermaid coloring pages,590,,0.03,,Coloring — unicorn/fairy/fantasy/princess,apify_autocomplete,1,unicorn mermaid coloring pages
y2k drawings pinterest easy,480,0,,informational,Drawing/sketch — other,dataforseo,1,y2k drawings pinterest easy
how to draw cute things step-by-step,480,2,0.03,informational,How to draw / tutorials,dataforseo,3,how to draw cute things step-by-step ; how to draw cute things step by step ; cute things to draw step by step
dresses drawing ideas,480,0,,informational,Drawing ideas — by style/theme,dataforseo,1,dresses drawing ideas
slavery drawing ideas,480,0,,informational,Drawing ideas — by style/theme,dataforseo,1,slavery drawing ideas
drawing ideas for pictionary,480,1,,informational,Drawing ideas — by style/theme,dataforseo,3,drawing ideas for pictionary ; pictionary drawing ideas ; drawing pictionary ideas
drawing paper dragon puppet ideas,480,0,,informational,Coloring — unicorn/fairy/fantasy/princess,dataforseo,1,drawing paper dragon puppet ideas
contest drawing ideas,480,0,,informational,Drawing ideas — by style/theme,dataforseo,4,contest drawing ideas ; drawing contest ideas ; ideas for drawing contest ; ideas for a drawing contest
digital drawing ideas,480,0,7.72,informational,Drawing ideas — by style/theme,dataforseo,1,digital drawing ideas
name drawing ideas,480,0,,informational,Drawing ideas — by style/theme,dataforseo,4,name drawing ideas ; drawing name ideas ; drawing names ideas ; ideas for drawing names
dark drawing ideas,480,0,,informational,Drawing ideas — by style/theme,dataforseo,1,dark drawing ideas
father daughter drawing ideas,480,0,0.03,informational,Drawing ideas — by style/theme,dataforseo,2,father daughter drawing ideas ; father #daughter drawing ideas
drawing ideas depression,480,0,,informational,Drawing ideas — by style/theme,dataforseo,3,drawing ideas depression ; drawing ideas for depression ; depression drawing ideas
drawing ideas for earth day,480,0,0.14,informational,Drawing ideas — by style/theme,dataforseo,2,drawing ideas for earth day ; earth day drawing ideas
drawing ideas black and white,480,0,0.07,informational,Drawing ideas — by style/theme,dataforseo,2,drawing ideas black and white ; black and white drawing ideas
cute doodles aesthetic drawing ideas easy,480,0,0.02,informational,Drawing ideas — by style/theme,dataforseo,1,cute doodles aesthetic drawing ideas easy
turkey drawing ideas,480,0,,informational,Drawing ideas — by style/theme,dataforseo,1,turkey drawing ideas
still life drawing ideas,480,0,,informational,Drawing ideas — by style/theme,dataforseo,5,still life drawing ideas ; drawing still life ideas ; still life ideas drawing ; still life ideas for drawing ; ideas for still life drawing
st patrick's day drawing ideas,480,0,0.01,informational,Drawing ideas — by style/theme,dataforseo,1,st patrick's day drawing ideas
spider-man drawing ideas,480,0,0.13,informational,Coloring — licensed/characters,dataforseo,2,spider-man drawing ideas ; spider man drawing ideas
art pencil drawing ideas,480,0,,informational,Drawing ideas — by style/theme,dataforseo,1,art pencil drawing ideas
scientific drawing ideas,480,0,,informational,Drawing ideas — by style/theme,dataforseo,1,scientific drawing ideas
beginner friendly drawing ideas,480,0,,informational,Drawing ideas — by style/theme,dataforseo,1,beginner friendly drawing ideas
drawing ideas spiderman,480,0,0.13,informational,Coloring — licensed/characters,dataforseo,2,drawing ideas spiderman ; spiderman drawing ideas
drawing ideas faces,480,0,0.09,informational,Drawing ideas — by style/theme,dataforseo,6,drawing ideas faces ; face drawing ideas ; faces drawing ideas ; drawing face ideas ; face ideas drawing ; drawing faces ideas
hand drawing ideas on skin,480,0,,informational,Drawing ideas — by style/theme,dataforseo,1,hand drawing ideas on skin
drawing topic ideas,480,0,,informational,Drawing/sketch — other,dataforseo,1,drawing topic ideas
christmas ornament drawing ideas,480,0,,informational,Coloring — seasonal/holiday,dataforseo,2,christmas ornament drawing ideas ; christmas ornaments drawing ideas
saint patrick's day drawing ideas,480,0,0.01,informational,Drawing ideas — by style/theme,dataforseo,1,saint patrick's day drawing ideas
sketch christmas drawing ideas,480,0,,informational,Coloring — seasonal/holiday,dataforseo,2,christmas sketch drawing ideas ; sketch christmas drawing ideas
food drawing ideas,480,0,,informational,Coloring — flowers/nature/food/vehicles,dataforseo,1,food drawing ideas
unique creative drawing ideas,480,0,,informational,Drawing ideas — by style/theme,dataforseo,1,unique creative drawing ideas
kawaii drawing ideas,480,0,0.02,informational,Drawing ideas — by style/theme,dataforseo,1,kawaii drawing ideas
simple objects drawing ideas,480,0,,informational,Drawing ideas — by style/theme,dataforseo,1,simple objects drawing ideas
science drawing ideas,480,0,,informational,Drawing ideas — by style/theme,dataforseo,1,science drawing ideas
depressed drawing ideas,480,3,,informational,Drawing ideas — by style/theme,dataforseo,1,depressed drawing ideas
drawing ideas mushroom,480,0,0.03,informational,Drawing ideas — by style/theme,dataforseo,4,drawing ideas mushroom ; drawing ideas mushrooms ; mushroom drawing ideas ; mushrooms drawing ideas
cute christmas card ideas drawing,480,0,,informational,Coloring — seasonal/holiday,dataforseo,1,cute christmas card ideas drawing
drawing ideas for competition,480,0,,informational,Drawing ideas — by style/theme,dataforseo,3,drawing ideas for competition ; drawing competition ideas ; ideas for drawing competition
grunge drawing ideas,480,0,,informational,Drawing ideas — by style/theme,dataforseo,1,grunge drawing ideas
how to draw 11 from stranger things,480,0,,informational,How to draw / tutorials,dataforseo,1,how to draw 11 from stranger things
things to draw colored pencils,480,0,0.19,informational,Drawing ideas — by style/theme,dataforseo,3,things to draw colored pencils ; things to draw with colored pencil ; things to draw with colored pencils
how to draw cute things kawaii,480,0,0.02,informational,How to draw / tutorials,dataforseo,4,how to draw cute things kawaii ; cute kawaii things to draw ; kawaii cute things to draw ; cute things to draw kawaii
western things to draw,480,0,0.01,informational,Drawing ideas — by style/theme,dataforseo,1,western things to draw
things to draw for father's day,480,0,0.03,informational,Drawing ideas — by style/theme,dataforseo,1,things to draw for father's day
how to draw real life things,480,0,,informational,How to draw / tutorials,dataforseo,1,how to draw real life things
things to draw when bored with pencil,480,0,,informational,Drawing ideas — by style/theme,dataforseo,1,things to draw when bored with pencil
things to draw easy but cool,480,0,,informational,Drawing ideas — by style/theme,dataforseo,3,things to draw easy but cool ; easy but cool things to draw ; cool but easy things to draw
green things to draw,480,0,,informational,Drawing ideas — by style/theme,dataforseo,1,green things to draw
ocean things to draw,480,0,0.01,informational,Drawing ideas — by style/theme,dataforseo,1,ocean things to draw
how to draw cool things book,480,0,0.41,informational,Coloring — format (free/printable/pdf/online),dataforseo,1,how to draw cool things book
strange things to draw,480,0,,informational,Drawing ideas — by style/theme,dataforseo,1,strange things to draw
cute simple easy things to draw,480,0,0.02,informational,Drawing ideas — by style/theme,dataforseo,1,cute simple easy things to draw
tiny things to draw,480,0,0.17,informational,Drawing ideas — by style/theme,dataforseo,1,tiny things to draw
things to draw detailed,480,0,0.03,informational,Drawing ideas — by style/theme,dataforseo,3,things to draw detailed ; how to draw detailed things ; detailed things to draw
red things to draw,480,0,,informational,Drawing ideas — by style/theme,dataforseo,1,red things to draw
how to draw real things,480,0,,informational,How to draw / tutorials,dataforseo,1,how to draw real things
cute fall things to draw,480,0,,informational,Coloring — seasonal/holiday,dataforseo,1,cute fall things to draw
simple things to draw when bored,480,0,,informational,Drawing ideas — by style/theme,dataforseo,1,simple things to draw when bored
cool things to draw on your arm,480,0,,informational,Drawing ideas — by style/theme,dataforseo,1,cool things to draw on your arm
things to draw wheel,480,0,,informational,Drawing ideas — by style/theme,dataforseo,2,things to draw wheel ; wheel of things to draw
cute halloween things to draw,480,0,,informational,Coloring — seasonal/holiday,dataforseo,3,cute halloween things to draw ; cute things to draw halloween ; cute things to draw for halloween
cute summer things to draw,480,0,0.02,informational,Coloring — seasonal/holiday,dataforseo,1,cute summer things to draw
easy kawaii things to draw,480,0,0.06,informational,Drawing ideas — by style/theme,dataforseo,1,easy kawaii things to draw
things to draw and color,480,0,0.05,informational,Drawing ideas — by style/theme,dataforseo,3,things to draw and color ; things to draw with color ; things to color and draw
things to draw with coloured pencils,480,0,0.19,informational,Drawing ideas — by style/theme,dataforseo,1,things to draw with coloured pencils
purple things to draw,480,0,,informational,Drawing ideas — by style/theme,dataforseo,1,purple things to draw
things to draw and colour,480,3,0.05,informational,Drawing ideas — by style/theme,dataforseo,1,things to draw and colour
quick sketch ideas,480,0,,informational,Drawing ideas — by style/theme,dataforseo,1,quick sketch ideas
doodle ideas pinterest,480,1,,informational,Drawing ideas — by style/theme,dataforseo,3,doodle ideas pinterest ; pinterest doodle ideas ; doodle pinterest ideas
pikachu coloring pages printable,480,0,,informational,Coloring — format (free/printable/pdf/online),dataforseo,2,pikachu coloring pages printable ; printable pikachu coloring pages
coloring pages for adults easy printable,480,6,0.97,informational,Coloring — audience (kids/adults/toddler),dataforseo,2,coloring pages for adults easy printable ; easy adult coloring pages printable
sprunki printable coloring pages,480,0,,informational,Coloring — format (free/printable/pdf/online),dataforseo,2,sprunki printable coloring pages ; sprunki coloring pages printable
free printable easter egg coloring pages,480,2,0.41,informational,Coloring — seasonal/holiday,dataforseo,1,free printable easter egg coloring pages
